,Unnamed: 0,text,sentiment,clean_text,label,username,date
750,750,"rm sapu lidi merupakan salah satu rumah makan yang memiliki keunikan , karena rumah makan ini seakan terletak di tengah sawah . apabila padi sedang menguning , pemandangan sangat indah dengan suara gemerisik akibat batang padi yang tertiup angin . makanan yang tersedia khas masakan sunda yang lezat dan menggugah selera . dengan layanan yang cepat , membuat selalu senang bersantap di sini .",positive,"rm sapu lidi merupakan salah satu rumah makan yang memiliki keunikan , karena rumah makan ini seakan terletak di tengah sawah . apabila padi sedang menguning , pemandangan sangat indah dengan suara gemerisik akibat batang padi yang tertiup angin . makanan yang tersedia khas masakan sunda yang lezat dan menggugah selera . dengan layanan yang cepat , membuat selalu senang bersantap di sini .",2,pangestuganis,2023-07-19
751,751,"kalau bukan karena pak jokowi , indonesia pasti sudah tidak ada bentuk nya , terima kasih , pak .",positive,"kalau bukan karena pak jokowi , indonesia pasti sudah tidak ada bentuk nya , terima kasih , pak .",2,polsekuh,2023-04-02
752,752,disarankan tidak membawa kendaraan pribadi karena parkiran nya sempit dan tempat nya terletak di hook per4an simpang dago . sangat ramai banyak abg yang makan atau sekadar nongkrong di situ . sejujur nya jadi malas sih .,negative,disarankan tidak membawa kendaraan pribadi karena parkiran nya sempit dan tempat nya terletak di hook per4an simpang dago . sangat ramai banyak abg yang makan atau sekadar nongkrong di situ . sejujur nya jadi malas sih .,1,yusufiqbaliqbal,2023-07-17
753,753,hancur ya ormas mu ? ya iya orang ormas mu itu tidak berguna .,negative,hancur ya ormas mu ? ya iya orang ormas mu itu tidak berguna .,1,henisafitry1,2023-04-20
754,754,"tempat asik , makanan lumayan lengkap , ke sini pas malam hari lampu lampu nya keren , pemesanan tempat sangat terorganisir .",positive,"tempat asik , makanan lumayan lengkap , ke sini pas malam hari lampu lampu nya keren , pemesanan tempat sangat terorganisir .",2,elizamo96,2023-03-25
755,755,"kalau saya keluarga ke bandung pasti menginap di the valley karena the valley adalah hotel resort bintang 3 sangat pantas untuk dikunjungi oleh keluarga yang ingin menginap di bandung , anda akan menikmati makan pagi yang lengkap dari makanan nasional sampai dengan barat eropa layaknya hotel bintang5 , untuk memanjakan anak dilengkapi outbond , kolam renang hangat dan lain-lain , karaoke gratis . jadi tunggu apalagi segera ajak keluarga anda . sebaiknya datang dengan keluarga lebih seru .",positive,"kalau saya keluarga ke bandung pasti menginap di the valley karena the valley adalah hotel resort bintang 3 sangat pantas untuk dikunjungi oleh keluarga yang ingin menginap di bandung , anda akan menikmati makan pagi yang lengkap dari makanan nasional sampai dengan barat eropa layaknya hotel bintang5 , untuk memanjakan anak dilengkapi outbond , kolam renang hangat dan lainlain , karaoke gratis . jadi tunggu apalagi segera ajak keluarga anda . sebaiknya datang dengan keluarga lebih seru .",2,polsekuh,2023-05-05
756,756,"lawakan antv tidak lucu , tutup saja acara nya",negative,"lawakan antv tidak lucu , tutup saja acara nya",1,rfatiasari,2023-04-07
757,757,"resto yang bernuansa nyaman dan dapat melihat pemandangan kota bandung yang indah khusu nya di petang atau malam hari . suasana yang romantis jika bersama pasangan anda , maupun penuh kehangatan bersama keluarga anda .",positive,"resto yang bernuansa nyaman dan dapat melihat pemandangan kota bandung yang indah khusu nya di petang atau malam hari . suasana yang romantis jika bersama pasangan anda , maupun penuh kehangatan bersama keluarga anda .",2,mediaindonesia,2023-08-19
758,758,lotek dan petis tahu adalah favorit saya di sini . tapi yang terpopuler adalah nasi bakmoy - nya . selain itu ada juga aneka rujak .,positive,lotek dan petis tahu adalah favorit saya di sini . tapi yang terpopuler adalah nasi bakmoy nya . selain itu ada juga aneka rujak .,2,polsekuh,2023-07-09
759,759,"sate ayam nya juara ! sate nya empuk dan enak walaupun tidak dimakan dengan saus nya . sate kambing nya juga cukup enak , empuk dan tidak bau diri nya . cukup terasa kalau semua bahan-bahan nya segar . kalau gule kambing , sepertinya kami kurang beruntung . mungkin karena kami datang sudah jam 9 malam , dan yang terhidang di gulai nya hanya lemak tanpa daging",positive,"sate ayam nya juara ! sate nya empuk dan enak walaupun tidak dimakan dengan saus nya . sate kambing nya juga cukup enak , empuk dan tidak bau diri nya . cukup terasa kalau semua bahanbahan nya segar . kalau gule kambing , sepertinya kami kurang beruntung . mungkin karena kami datang sudah jam 9 malam , dan yang terhidang di gulai nya hanya lemak tanpa daging",2,daringid,2023-12-28
760,760,"orang-orang yang pemikiran nya sempit menganggap yang dibakar bendera hti , padahal yang dibakar itu bendera al-liwa .",negative,"orangorang yang pemikiran nya sempit menganggap yang dibakar bendera hti , padahal yang dibakar itu bendera alliwa .",1,elizamo96,2023-07-16
761,761,dasar ruhut penjilat . jilat terus saja si pak jokowi . setiap kali ganti presiden ganti jilatan nya .,negative,dasar ruhut penjilat . jilat terus saja si pak jokowi . setiap kali ganti presiden ganti jilatan nya .,1,henisafitry1,2023-12-01
762,762,kadang saya merasa tersayat hati ini pinjam isilah melihat betapa bego nya dari partey reklamasi yang isi nya cuma kecebong2 dungu pinjam istilah yang bernalar mangkrak iq200 !,negative,kadang saya merasa tersayat hati ini pinjam isilah melihat betapa bego nya dari partey reklamasi yang isi nya cuma kecebong2 dungu pinjam istilah yang bernalar mangkrak iq200 !,1,polsekuh,2023-12-23
763,763,"saya tidak pernah suka terong sampai dicoba terong raos di pandan wangi . enak banget , bikin ketagihan . selain terong , hampir semua makanan nya enak-enak . saya pernah coba ayam ungkep , gurame bakar , perkedel kentang , genjer , kangkung , semuanya enak ! saran saya , jangan datang di akhir pekan atau hari libur karena dijamin tidak kebagian tempat penuh sekali .",positive,"saya tidak pernah suka terong sampai dicoba terong raos di pandan wangi . enak banget , bikin ketagihan . selain terong , hampir semua makanan nya enakenak . saya pernah coba ayam ungkep , gurame bakar , perkedel kentang , genjer , kangkung , semuanya enak ! saran saya , jangan datang di akhir pekan atau hari libur karena dijamin tidak kebagian tempat penuh sekali .",2,erwinhan1975,2023-06-29
764,764,produk uni lever sangat banyak dan murah,positive,produk uni lever sangat banyak dan murah,2,polsekuh,2023-03-28
765,765,"megawati lebih dari mampu , bahkan mampu melahirkan jokowi , penerus tegak nya negara ini",positive,"megawati lebih dari mampu , bahkan mampu melahirkan jokowi , penerus tegak nya negara ini",2,elizamo96,2023-09-02
766,766,"terletak di depan plaza bip , parkiran yang luas dan buka 24 jam , merupakan tempat berkumpul di kala janjian dan tempat pertolongan dikala kelaparan di atas jam 12 malam , karena buka 24 jam jadi lanjut terus",positive,"terletak di depan plaza bip , parkiran yang luas dan buka 24 jam , merupakan tempat berkumpul di kala janjian dan tempat pertolongan dikala kelaparan di atas jam 12 malam , karena buka 24 jam jadi lanjut terus",2,bambang_hesti,2023-07-10
767,767,agar peristiwa tidak terulang terus-terusan aksi-aksi brutal oleh kelompok fpi harus segera di bubarkan,negative,agar peristiwa tidak terulang terusterusan aksiaksi brutal oleh kelompok fpi harus segera di bubarkan,1,oestamdwi,2023-01-31
768,768,"lokasi strategis , ke arah dago . buka 24 jam . pelayanan ramah , makanan standar mc di , sering dipakai belajar kelompok mahasiswa , dekat itb , unpad , ithb , unikom , unpar",positive,"lokasi strategis , ke arah dago . buka 24 jam . pelayanan ramah , makanan standar mc di , sering dipakai belajar kelompok mahasiswa , dekat itb , unpad , ithb , unikom , unpar",2,soloposdotcom,2023-04-09
769,769,"lokasi food court sangat strategis di jalan pasir kalilki dan tidak jauh dari stasiun bandung . mudah dicapai degan angkutan umum . di sini bebagai jenis makanan baik sunda , nusantra , maupun mancanegara ada tersedia . rasanya lezat dan harga juga bersahabar dengan kondisi andong . pendek kata , setiap mampir ke bandung , saya sempatkan berwisata kuliner di paskal makanan market .",positive,"lokasi food court sangat strategis di jalan pasir kalilki dan tidak jauh dari stasiun bandung . mudah dicapai degan angkutan umum . di sini bebagai jenis makanan baik sunda , nusantra , maupun mancanegara ada tersedia . rasanya lezat dan harga juga bersahabar dengan kondisi andong . pendek kata , setiap mampir ke bandung , saya sempatkan berwisata kuliner di paskal makanan market .",2,waspadaonline,2023-01-08
770,770,banyak orang membenci hti karena arogan,negative,banyak orang membenci hti karena arogan,1,voaislam,2023-01-02
771,771,"gam gerakan aceh merdeka saja dihabiskan ?! masak timor leste ? tidak di habiskan ? di mana suara hendrapriyono , ora sumbut naik di atas ring ?!",negative,"gam gerakan aceh merdeka saja dihabiskan ?! masak timor leste ? tidak di habiskan ? di mana suara hendrapriyono , ora sumbut naik di atas ring ?!",1,kanalindonesia,2023-02-23
772,772,"awal nya ketika saya sedang kelaparan dan berada di istana plasa . awal nya kami mau makan dim sum di eastern , tapi ternyata minimum 3 pax . akhirnya kami berkeliling ip , sesampai nya di kingkong , saya melihat sepertinya menu yang tersedia cocok untuk saya dan istri . ketika saya memesan ditawari porsi kingkong yang kata nya cukup untuk berdua . ternyata memang sangat banyak dan cukup untuk berdua . saya jadi senang .",positive,"awal nya ketika saya sedang kelaparan dan berada di istana plasa . awal nya kami mau makan dim sum di eastern , tapi ternyata minimum 3 pax . akhirnya kami berkeliling ip , sesampai nya di kingkong , saya melihat sepertinya menu yang tersedia cocok untuk saya dan istri . ketika saya memesan ditawari porsi kingkong yang kata nya cukup untuk berdua . ternyata memang sangat banyak dan cukup untuk berdua . saya jadi senang .",2,indonesiana,2023-03-12
773,773,salah satu tempat makan di bandung yang menjadi favorit karena masakan yang enak dan pelayanan yang menyenangkan . suasana tempat makan yang serius dipikirkan sehingga mempunyai cita rasa yang menarik dipadu makanan yang enak membuat betah dan berpikir untuk datang lagi . ini asli rekomendasi banget untuk didatangi dan dicoba masakan nya . bandung memang surga nya makanan dan bebek garang benar-benar gahar .,positive,salah satu tempat makan di bandung yang menjadi favorit karena masakan yang enak dan pelayanan yang menyenangkan . suasana tempat makan yang serius dipikirkan sehingga mempunyai cita rasa yang menarik dipadu makanan yang enak membuat betah dan berpikir untuk datang lagi . ini asli rekomendasi banget untuk didatangi dan dicoba masakan nya . bandung memang surga nya makanan dan bebek garang benarbenar gahar .,2,kelvinbagashar1,2023-01-14
774,774,jokowi tidak suka jika dituduh pki,negative,jokowi tidak suka jika dituduh pki,1,kelvinbagashar1,2023-02-12
775,775,"bayar indihome mahal unduh 11,9 mb saja 5 menit jiaw , kenceng nya diawalawal doang .",negative,"bayar indihome mahal unduh 11,9 mb saja 5 menit jiaw , kenceng nya diawalawal doang .",1,kelvinbagashar1,2023-12-31
776,776,"sebenarnya kami ke the peak ini cuma karena penasaran karena pemandangan nya bagus . setelah menempuh sekitar 1 jam perjalanan dari bandung kota dan melewati jalan yang naik turun seperti kehidupan saya hahaha . sampai deh kami di tkp , sekilas dari luar sih biasa tapi begitu masuk ke dalam ternyata sama saja hahaha . menurut kami biasa saja seperti resto atau kafe di tempat lainnya .",negative,"sebenarnya kami ke the peak ini cuma karena penasaran karena pemandangan nya bagus . setelah menempuh sekitar 1 jam perjalanan dari bandung kota dan melewati jalan yang naik turun seperti kehidupan saya hahaha . sampai deh kami di tkp , sekilas dari luar sih biasa tapi begitu masuk ke dalam ternyata sama saja hahaha . menurut kami biasa saja seperti resto atau kafe di tempat lainnya .",1,rodosr3,2023-08-06
777,777,"tidak puas sama sekali . pesan teh tarik kemanisan , memesan kentang goreng layu tidak panas pas datang . sudah pasti tidak akan kembali lagi . agak menyesal bawa keluarga ke sini .",negative,"tidak puas sama sekali . pesan teh tarik kemanisan , memesan kentang goreng layu tidak panas pas datang . sudah pasti tidak akan kembali lagi . agak menyesal bawa keluarga ke sini .",1,kompascom,2023-07-07
778,778,"lagi jalan-jalan di bandung ? setelah belanja di fo jalan . riau , tak ada salah nya singgah di dakken . bisa pilih mau di ruangan khusus yang pribadi atau di ruang tengah yang terbuka . mau minum kopi , atau sekedar makanan ringan atau makanan berat ada di sini . interior nya menawan . ada gazebo mungil di belakang . secara keseluruhan tempat ini cocok untuk berkumpul untuk melepas kangen dengan teman-teman .",positive,"lagi jalanjalan di bandung ? setelah belanja di fo jalan . riau , tak ada salah nya singgah di dakken . bisa pilih mau di ruangan khusus yang pribadi atau di ruang tengah yang terbuka . mau minum kopi , atau sekedar makanan ringan atau makanan berat ada di sini . interior nya menawan . ada gazebo mungil di belakang . secara keseluruhan tempat ini cocok untuk berkumpul untuk melepas kangen dengan temanteman .",2,jelajahbantul,2023-05-26
779,779,"lumayan dapat rasa makassar nya meskipun masih kurang mantap , tidak seperti asli nya di makassar . harga sedikit middle up , tapi sesuai dengan porsi nya .",positive,"lumayan dapat rasa makassar nya meskipun masih kurang mantap , tidak seperti asli nya di makassar . harga sedikit middle up , tapi sesuai dengan porsi nya .",2,budiyanadesani,2023-12-31
780,780,"lokasi mudah ditemukan dengan kanopi merah menyala di pinggir jalan . tidak usah jaga image memilih cara makan ternikmat untuk menikmati masakan nikmat . cuci tangan yang bersih dan lupakan sendok garpu untuk menyantap dan menguliti makanan yang tersaji di depan mata . porsi besar , untuk wanita mungkin bisa berbagi dengan teman pria anda taktala memesan bebek ini .",positive,"lokasi mudah ditemukan dengan kanopi merah menyala di pinggir jalan . tidak usah jaga image memilih cara makan ternikmat untuk menikmati masakan nikmat . cuci tangan yang bersih dan lupakan sendok garpu untuk menyantap dan menguliti makanan yang tersaji di depan mata . porsi besar , untuk wanita mungkin bisa berbagi dengan teman pria anda taktala memesan bebek ini .",2,plsk_jeparakota,2023-02-03
781,781,saya baru tahu kalau kedai nyonya rumah yang ada di jalan naripan ini ternyata menjual kue-kue juga . waktu itu iseng beli dan ternyata rasanya enak dan tidak mengecewakan . harga nya juga masih bisa dibilang wajar . dan yang menarik perhatian adalah ternyata mereka menjual semacam tokyo banana versi mereka sendiri,positive,saya baru tahu kalau kedai nyonya rumah yang ada di jalan naripan ini ternyata menjual kuekue juga . waktu itu iseng beli dan ternyata rasanya enak dan tidak mengecewakan . harga nya juga masih bisa dibilang wajar . dan yang menarik perhatian adalah ternyata mereka menjual semacam tokyo banana versi mereka sendiri,2,wisatasleman,2023-08-26
782,782,"apa beda nya nasi goreng mafia dengan nasi goreng pada umum nya ? sebagai pencinta nasi goreng yang sudah mencoba berbagai macam jenis nasi goreng dari yang murah di pinggir jalan sampai di restoran yang mahal , tentu nasi goreng mafia ini membuat penasaran dan wajib untuk dicoba . setiap menu diberikan nama yang unik juga , ada yang nama nya nasi goreng berandal , gangster , yakuza , dll.",positive,"apa beda nya nasi goreng mafia dengan nasi goreng pada umum nya ? sebagai pencinta nasi goreng yang sudah mencoba berbagai macam jenis nasi goreng dari yang murah di pinggir jalan sampai di restoran yang mahal , tentu nasi goreng mafia ini membuat penasaran dan wajib untuk dicoba . setiap menu diberikan nama yang unik juga , ada yang nama nya nasi goreng berandal , gangster , yakuza , dll.",2,plsk_jeparakota,2023-11-23
783,783,"perjalanan dari jakarta tujuan ke bandung untuk menikmati situasi malam hari di kota bandung . sampai di bandung tujuan utama langsung tertuju ke the 18th restaurant lounge yang berlokasi di lantai 18 trans hotel bandung . first impression adalah tempat yanh romantis untuk bawa pasangan , crew restoran tanpa dipanggil , langsung menghampiri dan mencarikan tempat untuk kami .",positive,"perjalanan dari jakarta tujuan ke bandung untuk menikmati situasi malam hari di kota bandung . sampai di bandung tujuan utama langsung tertuju ke the 18th restaurant lounge yang berlokasi di lantai 18 trans hotel bandung . first impression adalah tempat yanh romantis untuk bawa pasangan , crew restoran tanpa dipanggil , langsung menghampiri dan mencarikan tempat untuk kami .",2,voaislam,2023-05-08
784,784,murah,positive,murah,2,kotamagetan_,2023-07-26
785,785,"saat awal mengenal bandung , batagor riri yang terletak di jalan burangrang ini merupakan tempat makan favourit saya sekeluarga . walaupun sekarang banyak batagor-batagor lain , batagor riri menjadi oleh-oleh khas bandung yang wajib saya bawa .",positive,"saat awal mengenal bandung , batagor riri yang terletak di jalan burangrang ini merupakan tempat makan favourit saya sekeluarga . walaupun sekarang banyak batagorbatagor lain , batagor riri menjadi oleholeh khas bandung yang wajib saya bawa .",2,yoghayalestio,2023-04-01
786,786,di bandung dengan begitu banyak pilihan makanan kami memutuskan untuk mampir ke batagor riri . dengan harga yang tinggi tapi ternyata rasa batagor nya biasa saja . bagi yang belum pernah mencoba kami tidak merekomendasikan nya kecuali kalau anda memang sangat penasaran .,positive,di bandung dengan begitu banyak pilihan makanan kami memutuskan untuk mampir ke batagor riri . dengan harga yang tinggi tapi ternyata rasa batagor nya biasa saja . bagi yang belum pernah mencoba kami tidak merekomendasikan nya kecuali kalau anda memang sangat penasaran .,2,polseksumur,2023-03-13
787,787,"makan di warung steak selalu dipenuhi oleh pengunjung utama nya mahasiswa , sejak dulu warung steak ini menyajikan steak dengan citarasa yang enak namun tidak bikin kantong bolong , berbagai jenis steak pun disediakan , ada steak ayam , daging sapi dan menu lain . waktu tunggu makanan pun tergolong cepat .",positive,"makan di warung steak selalu dipenuhi oleh pengunjung utama nya mahasiswa , sejak dulu warung steak ini menyajikan steak dengan citarasa yang enak namun tidak bikin kantong bolong , berbagai jenis steak pun disediakan , ada steak ayam , daging sapi dan menu lain . waktu tunggu makanan pun tergolong cepat .",2,voaislam,2023-08-13
788,788,"menyajikan masakan tempo dulu , suasana kafe didekor dengan hiasan poster-poster zaman enzim dahulu . yang favorit : nasi goreng dan kerupuk banjur nya",positive,"menyajikan masakan tempo dulu , suasana kafe didekor dengan hiasan posterposter zaman enzim dahulu . yang favorit nasi goreng dan kerupuk banjur nya",2,ndraz_ymmot,2023-01-23
789,789,"resto ini tempat nya nyaman serta ada tempat gazebo nya . desain interior nya sangat menawan dengan penataan yang serasi . layanan nya cukup baik . tersedia berbagai menu seperti tahu kampoeng isi keju , chicken quesadilas , cream of mushroom , sop buntut goreng , beef rice , sirloin steak , pepper steak , grilled chicken steak , dan sebagai nya . tenderloin steak daging nya empuk dan saus nya enak .",positive,"resto ini tempat nya nyaman serta ada tempat gazebo nya . desain interior nya sangat menawan dengan penataan yang serasi . layanan nya cukup baik . tersedia berbagai menu seperti tahu kampoeng isi keju , chicken quesadilas , cream of mushroom , sop buntut goreng , beef rice , sirloin steak , pepper steak , grilled chicken steak , dan sebagai nya . tenderloin steak daging nya empuk dan saus nya enak .",2,idntodayco,2023-12-01
790,790,"aksi-aksi , balok ormas gmb , iwan bopeng , steven , nathan , rumah sby digeruduk , banser bubarkan pengajian , massa pro ahok menyandera pegawai lp , penghadangan fahri hamzah , ustad tengku di bandara , itu semua persekusi bukan ?",neutral,"aksiaksi , balok ormas gmb , iwan bopeng , steven , nathan , rumah sby digeruduk , banser bubarkan pengajian , massa pro ahok menyandera pegawai lp , penghadangan fahri hamzah , ustad tengku di bandara , itu semua persekusi bukan ?",0,voaislam,2023-05-27
791,791,"pertama kali saya menginjakan kaki di hotel padma , saya begitu terpesona dengan konsep hotel yang dimiliki karena kita dapat melihat lembah yang ada di bandung dan udara sejuk nya bandung . keesokan hari nya saya makan di restoran yang merupakan fasilitas dari hotel padma . the restoran memiliki pemandangan yang begitu menawan . the restoran ini memiliki konsep yang berbeda dengan restoran lain .",positive,"pertama kali saya menginjakan kaki di hotel padma , saya begitu terpesona dengan konsep hotel yang dimiliki karena kita dapat melihat lembah yang ada di bandung dan udara sejuk nya bandung . keesokan hari nya saya makan di restoran yang merupakan fasilitas dari hotel padma . the restoran memiliki pemandangan yang begitu menawan . the restoran ini memiliki konsep yang berbeda dengan restoran lain .",2,zalinaraine,2023-04-13
792,792,cocok untuk nongkrong dengan teman . pilihan minuman alkohol nya seperti wine terbatas dan harga nya lumayan mahal,positive,cocok untuk nongkrong dengan teman . pilihan minuman alkohol nya seperti wine terbatas dan harga nya lumayan mahal,2,zalinaraine,2023-07-21
793,793,"siap bunda , sasarengan menangkeun kanggo jawa barat hiji , insyaallah pasukan majalengka siap menangken jawa barat anu takwa .",positive,"siap bunda , sasarengan menangkeun kanggo jawa barat hiji , insyaallah pasukan majalengka siap menangken jawa barat anu takwa .",2,zalinaraine,2023-10-25
794,794,"pilkada 2018 , gerindra tak mau disebut babak belur di pulau jawa",neutral,"pilkada 2018 , gerindra tak mau disebut babak belur di pulau jawa",0,plsk_jeparakota,2023-12-23
795,795,senin selalu melelahkan karena dosen killer yang bikin malas masuk kelas,negative,senin selalu melelahkan karena dosen killer yang bikin malas masuk kelas,1,miraclecathy,2023-01-20
796,796,congo ini tempat nya tidak jauh dari jalan raya dago pakar . arsitektur ruangan kebanyakan memainkan beberapa bentuk kayu sehingga menghadirkan suasana yang hangat di tengah dingin nya udara dago pakar di malam hari . suasana nya nyaman sekali untuk kumpul keluarga dan kumpul bareng teman-teman . pancake cokelat nya enak banget deh ! menu di sini kebanyakan makanan barat . harga nya tidak terlalu mahal .,positive,congo ini tempat nya tidak jauh dari jalan raya dago pakar . arsitektur ruangan kebanyakan memainkan beberapa bentuk kayu sehingga menghadirkan suasana yang hangat di tengah dingin nya udara dago pakar di malam hari . suasana nya nyaman sekali untuk kumpul keluarga dan kumpul bareng temanteman . pancake cokelat nya enak banget deh ! menu di sini kebanyakan makanan barat . harga nya tidak terlalu mahal .,2,miraclecathy,2023-12-13
797,797,gue enggak suka makan di nalu bowls . rasanya aneh . harga nya juga mahal .,negative,gue enggak suka makan di nalu bowls . rasanya aneh . harga nya juga mahal .,1,plsk_jeparakota,2023-02-09
798,798,"pemandangan bagus banget , keren cocok buat yang gemar selfie karena banyak titik nya , makanan lumayan , oke rekomendasi .",positive,"pemandangan bagus banget , keren cocok buat yang gemar selfie karena banyak titik nya , makanan lumayan , oke rekomendasi .",2,polsekwuryanto3,2023-09-29
799,799,"ayo kita bantu viralkan gerakan petani tebu yang tidak diliput luas oleh media , kita protes kebijakan pemerintahan jokowi yang kata nya pro rakyat kecil , ternyata pro wong licik . ternyata kita dipimpin rezim drakula impor",negative,"ayo kita bantu viralkan gerakan petani tebu yang tidak diliput luas oleh media , kita protes kebijakan pemerintahan jokowi yang kata nya pro rakyat kecil , ternyata pro wong licik . ternyata kita dipimpin rezim drakula impor",1,jayatogel,2023-06-03
800,800,salah satu alasan traveloka mau mensponsori produk nya di piala dunia ialah karena animo masyarakat dalam berinteraksi pada saat piala dunia tahun ini .,neutral,salah satu alasan traveloka mau mensponsori produk nya di piala dunia ialah karena animo masyarakat dalam berinteraksi pada saat piala dunia tahun ini .,0,kodimbantul,2023-04-24
801,801,"bapao manis dan asin nya mantap sekali , bapao nya ukuran nya besar , begitu juga siomay nya enak banget dicocol dengan sambal .",positive,"bapao manis dan asin nya mantap sekali , bapao nya ukuran nya besar , begitu juga siomay nya enak banget dicocol dengan sambal .",2,aditiaprabowo13,2023-04-04
802,802,"apabila anda penikmat pancake , anda harus mencoba makan di sini . cobalah makan pancake manggo atau greentea . sangat enak sekali . harga tidak begitu mahal . namun yang mahal adalah minuman nya . namun untuk harga , makanan dan juga pelayanan nya sangat bagus sekali dan anda patut coba . tempat nya sangat nyaman sekali baik bersama teman , keluarga maupun sama pacar .",positive,"apabila anda penikmat pancake , anda harus mencoba makan di sini . cobalah makan pancake manggo atau greentea . sangat enak sekali . harga tidak begitu mahal . namun yang mahal adalah minuman nya . namun untuk harga , makanan dan juga pelayanan nya sangat bagus sekali dan anda patut coba . tempat nya sangat nyaman sekali baik bersama teman , keluarga maupun sama pacar .",2,oposisicerdas,2023-10-16
803,803,sedih kalau umat diprovokasi supaya saling membenci .,negative,sedih kalau umat diprovokasi supaya saling membenci .,1,aditiaprabowo13,2023-03-27
804,804,"mantap , ini bakso malang terenak di depok menurut ku . bakso malang citra .",positive,"mantap , ini bakso malang terenak di depok menurut ku . bakso malang citra .",2,aditiaprabowo13,2023-03-02
