,Unnamed: 0,text,sentiment,clean_text,label,username,date
267,267,jangan mau pasang tidak rekomendasi banget . pelanggan tidak dianggap sama mereka . customer service bodo . teknisi datang kerja cuma bilang tidak bisa mengerjakan karena bukan bagian dia . what the fuck . berkali-berkali di telepon tidak ada perbaikan sampai hari ini .,negative,jangan mau pasang tidak rekomendasi banget . pelanggan tidak dianggap sama mereka . customer service bodo . teknisi datang kerja cuma bilang tidak bisa mengerjakan karena bukan bagian dia . what the fuck . berkaliberkali di telepon tidak ada perbaikan sampai hari ini .,1,fahmiamet,2023-08-25
268,268,"makanan yang disediakan begitu banyak dati mulai makanan lokal sampai western pun ada . yang paling saya suka yakni dessert slice cake yang dipajang tepat depan pintu masuk banyak pilihan dan rasanya pun yummyy . lalu untuk tempat anda bisa pilih tempat di dalam atau di luar tetapi biasanya ketika hujan tiba , tempat di luar ditutup . sayang nya di sini tidak bisa reservasi untuk makan malam .",positive,"makanan yang disediakan begitu banyak dati mulai makanan lokal sampai western pun ada . yang paling saya suka yakni dessert slice cake yang dipajang tepat depan pintu masuk banyak pilihan dan rasanya pun yummyy . lalu untuk tempat anda bisa pilih tempat di dalam atau di luar tetapi biasanya ketika hujan tiba , tempat di luar ditutup . sayang nya di sini tidak bisa reservasi untuk makan malam .",2,kemenkesri,2023-07-07
269,269,banyak jagoan pdip yang keok di pilkada .,neutral,banyak jagoan pdip yang keok di pilkada .,0,rmolofficial,2023-06-28
270,270,penipu,negative,penipu,1,jayakatwang15,2023-06-26
271,271,"ini tempat paling gue suka kemarin pas ke bandung , astaga makanan nya banyak banget tempat nya juga luas dan terbuka , pemandangan nya pas malam keren banget .",positive,"ini tempat paling gue suka kemarin pas ke bandung , astaga makanan nya banyak banget tempat nya juga luas dan terbuka , pemandangan nya pas malam keren banget .",2,jayakatwang15,2023-12-25
272,272,"islam itu agama sesat , harus di bakar hidup-hidup ! tunggu kami di indonesia",negative,"islam itu agama sesat , harus di bakar hiduphidup ! tunggu kami di indonesia",1,jayakatwang15,2023-10-18
273,273,"banyak makanan , menu nya banyak sekali . tempat nya asyik untuk pemandangan dan jangan hujan saja karena banyak sekali tempat terbuka .",positive,"banyak makanan , menu nya banyak sekali . tempat nya asyik untuk pemandangan dan jangan hujan saja karena banyak sekali tempat terbuka .",2,smartfm_sby,2023-04-30
274,274,kalau lagi ingin makan steak tapi dengan harga yang cukup terjangkau cocok di ws makan bersama dengan keluarga atau sahabat sangat menyenangkan . steak yang cukup enak dan murah serta orange jus yang begitu segar .,positive,kalau lagi ingin makan steak tapi dengan harga yang cukup terjangkau cocok di ws makan bersama dengan keluarga atau sahabat sangat menyenangkan . steak yang cukup enak dan murah serta orange jus yang begitu segar .,2,fahmiamet,2023-07-19
275,275,"mungkin anak remaja akan menyukai menu minuman yang dijual di sini namun saya kurang begitu suka dengan minuman yang aneh-aneh , selain itu harga nya juga relatif mahal untuk ukuran minuman jadi masih mikir-mikir sering-sering minum di sini .",positive,"mungkin anak remaja akan menyukai menu minuman yang dijual di sini namun saya kurang begitu suka dengan minuman yang anehaneh , selain itu harga nya juga relatif mahal untuk ukuran minuman jadi masih mikirmikir seringsering minum di sini .",2,jayakatwang15,2023-07-19
276,276,"tempat yang nyaman dengan pemandangan bukit yang indah dan udara yang sejuk sekali , jauh dari hiruk pikuk kota , makanan nya sungguh artistik dan uenak teman pelayanan nya juga sangat memuaskan , semua karyawan nya ramah-ramah . pokok nya tempat yang pas buat ngadem ataupun cuma nongkrong-nongkrong sama teman atau keluarga . koleksi wine yang ditawarkan juga cukup beragam hampir dari semua negara penghasil wine ada di sini , pokok nya .",positive,"tempat yang nyaman dengan pemandangan bukit yang indah dan udara yang sejuk sekali , jauh dari hiruk pikuk kota , makanan nya sungguh artistik dan uenak teman pelayanan nya juga sangat memuaskan , semua karyawan nya ramahramah . pokok nya tempat yang pas buat ngadem ataupun cuma nongkrongnongkrong sama teman atau keluarga . koleksi wine yang ditawarkan juga cukup beragam hampir dari semua negara penghasil wine ada di sini , pokok nya .",2,jayakatwang15,2023-11-01
277,277,"tempat yang satu ini sangat elegan dan menyediakan makanan yang lezat . pelayanan nya pun sangat baik . menu yang bisa dipesan seperti nasi timbal dengan aneka lauk seperti ayam , ikan , dan lain sebagai nya , selain itu , minuman yang disajikan benar bukan minuman abal-abal . rasanya mak nyus .",positive,"tempat yang satu ini sangat elegan dan menyediakan makanan yang lezat . pelayanan nya pun sangat baik . menu yang bisa dipesan seperti nasi timbal dengan aneka lauk seperti ayam , ikan , dan lain sebagai nya , selain itu , minuman yang disajikan benar bukan minuman abalabal . rasanya mak nyus .",2,tatakujiyati,2023-04-17
278,278,saya akui memang pemandangan di kafe ini memang juara . meskipun saya ke sana pada malam hari tapi kita tetap bisa menikmati pemandangan cahaya kota bandung . udara di sana cukup sejuk dan segar karena letak nya yang lumayan jauh dari pusat kota dan tidak ada angkutan umum yang melewati daerah ini . untuk makanan saya waktu itu memesan spicy chicken wings dan rasanya enak .,positive,saya akui memang pemandangan di kafe ini memang juara . meskipun saya ke sana pada malam hari tapi kita tetap bisa menikmati pemandangan cahaya kota bandung . udara di sana cukup sejuk dan segar karena letak nya yang lumayan jauh dari pusat kota dan tidak ada angkutan umum yang melewati daerah ini . untuk makanan saya waktu itu memesan spicy chicken wings dan rasanya enak .,2,futureadyid,2023-06-22
279,279,"untuk soal pemandangan dan tempat cukup enak untuk dilihat dan di nikmati . tetapi dari segi pelayanan sangat kurang . pesanan kami sangat lama dan banyak salah nya , sudah lama pesan baru di informasi kalau sudah habis . tempat untuk makan pun terbatas . sangat butuh improvement . satu hal lagi , kedua kalinya saya ke sana karena penuh , kami tidak jadi masuk ke dalam .",positive,"untuk soal pemandangan dan tempat cukup enak untuk dilihat dan di nikmati . tetapi dari segi pelayanan sangat kurang . pesanan kami sangat lama dan banyak salah nya , sudah lama pesan baru di informasi kalau sudah habis . tempat untuk makan pun terbatas . sangat butuh improvement . satu hal lagi , kedua kalinya saya ke sana karena penuh , kami tidak jadi masuk ke dalam .",2,walinews1,2023-01-11
280,280,suasana yang asri tapi sayang pelayan nya lambat . kalau order makanan sebaiknya sekaligus saja karena kalau mau order tambahan lagi biasanya susah untuk panggil petugas nya . makanan nya enak-enak dan unik . suasan nya santai dan nyaman .,positive,suasana yang asri tapi sayang pelayan nya lambat . kalau order makanan sebaiknya sekaligus saja karena kalau mau order tambahan lagi biasanya susah untuk panggil petugas nya . makanan nya enakenak dan unik . suasan nya santai dan nyaman .,2,prastiyo318,2023-10-30
281,281,"dekat dengan rumah tinggal saya ketika di bandung , saya sering ke supermarket ini untuk membeli beberapa makanan impor , seperti pizza beku .",positive,"dekat dengan rumah tinggal saya ketika di bandung , saya sering ke supermarket ini untuk membeli beberapa makanan impor , seperti pizza beku .",2,mediaindonesia,2023-04-05
282,282,lokasi terletak di lantai dasar festival city link mal . menyediakan makanan orang cina makanan . bagi penyuka bubur . bubur tawan ada adalah reccommended . menu lainnya lumayan enak .,positive,lokasi terletak di lantai dasar festival city link mal . menyediakan makanan orang cina makanan . bagi penyuka bubur . bubur tawan ada adalah reccommended . menu lainnya lumayan enak .,2,utuhlabil,2023-01-09
283,283,ui umat iblis . tidak malu sama putra papua yang belajar di antara rimba hutan tapi mempunyai otak bersih .,negative,ui umat iblis . tidak malu sama putra papua yang belajar di antara rimba hutan tapi mempunyai otak bersih .,1,polsekselat,2023-12-23
284,284,"makanan kampungan sekali udik payah ewwww banget tahu tidak cih makanan nya ada cicak , pur burung , jangkrik teru paling gila toilet kagak pernah di bersihkan meja bawah nya ada permen karet meja sampai per jamur ( menjijikan ) ( menjijikan )",negative,"makanan kampungan sekali udik payah ew banget tahu tidak cih makanan nya ada cicak , pur burung , jangkrik teru paling gila toilet kagak pernah di bersihkan meja bawah nya ada permen karet meja sampai per jamur menjijikan menjijikan",1,irenecutemom,2023-11-22
285,285,"pagi sore adalah salah satu restoran padang langganan saya di bandung , rasanya enak dan harga terjangkau",positive,"pagi sore adalah salah satu restoran padang langganan saya di bandung , rasanya enak dan harga terjangkau",2,bbcindonesia,2023-10-18
286,286,"suasana resto cukup nyaman dengan layanan yang cukup baik . menawarkan beragam menu dengan bahan dasar seafood seperti udang , gurame , bawal , kakap , kepiting dan juga ada ayam serta sayuran . gurame goreng rasanya gurih dan renyah . sambal mangga nya enak dan nikmat . ayam goreng fillet nya juga gurih dan enak . gurame bakar kecap dibakar dengan sempurna rasanya gurih . rata-rata masakan nya enak .",positive,"suasana resto cukup nyaman dengan layanan yang cukup baik . menawarkan beragam menu dengan bahan dasar seafood seperti udang , gurame , bawal , kakap , kepiting dan juga ada ayam serta sayuran . gurame goreng rasanya gurih dan renyah . sambal mangga nya enak dan nikmat . ayam goreng fillet nya juga gurih dan enak . gurame bakar kecap dibakar dengan sempurna rasanya gurih . ratarata masakan nya enak .",2,kompascom,2023-06-23
287,287,"suasana restoran nya nyaman , rumahan pissan la . andalan utama di sini sop buntut ala oma . tetapi kadang asin kadang enak pas : tetapi lumayanlah rasanya secara keseluruhan baik masih bisa dibilang enak . harga khas kafe bandung sih .",positive,"suasana restoran nya nyaman , rumahan pissan la . andalan utama di sini sop buntut ala oma . tetapi kadang asin kadang enak pas tetapi lumayanlah rasanya secara keseluruhan baik masih bisa dibilang enak . harga khas kafe bandung sih .",2,alfindwiyanto3,2023-10-28
288,288,kami menjual kabel hdmi premium 1 meter beli 2 gratis 1 di lapak rich com store risvatin88,neutral,kami menjual kabel hdmi premium 1 meter beli 2 gratis 1 di lapak rich com store risvatin88,0,nissanid,2023-02-22
289,289,gerindra masih melakukan sejumlah pertemuan lanjutan dengan pan dan pks untuk menentukan cawapres pendamping prabowo .,neutral,gerindra masih melakukan sejumlah pertemuan lanjutan dengan pan dan pks untuk menentukan cawapres pendamping prabowo .,0,warta_lika,2023-07-20
290,290,"1 potong batagor dengan harga 7500 , rasanya sangat mahal bukan ? saya mengenal batagor ini dari harga 1250 rupiah dengan kualitas yang lebih menggigit , tetapi sekarang ? menurut saya kuantitas dan kualitas nya jauh lebih menurun . alternatif lain untuk membeli batagor : batagor ikan , batagor bandung , batagor burangrang semuanya dekat dengan lokasi batagor riri",positive,"1 potong batagor dengan harga 7500 , rasanya sangat mahal bukan ? saya mengenal batagor ini dari harga 1250 rupiah dengan kualitas yang lebih menggigit , tetapi sekarang ? menurut saya kuantitas dan kualitas nya jauh lebih menurun . alternatif lain untuk membeli batagor batagor ikan , batagor bandung , batagor burangrang semuanya dekat dengan lokasi batagor riri",2,khayurohmi,2023-02-09
291,291,saya memesan makanan nasi timbel rasa standart tidak ada ikan asin gede rasa dan sayur asem nya kurang bumbu dan nasi rawon . penyajian nasi rawon unik tetapi dingin dan rasa hambar . harga makanan lumayan mahal . kp . daun cocok untuk santai hanya makanan perlu mendapatkan perbaikan .,positive,saya memesan makanan nasi timbel rasa standart tidak ada ikan asin gede rasa dan sayur asem nya kurang bumbu dan nasi rawon . penyajian nasi rawon unik tetapi dingin dan rasa hambar . harga makanan lumayan mahal . kp . daun cocok untuk santai hanya makanan perlu mendapatkan perbaikan .,2,anakmedan1974,2023-01-23
292,292,"dusun bambu , terletak di kaki gunung burangrang . dari terminal ledeng bandung , banyak sekali petunjuk jalan menuju lokasi , sehingga tidak perlu khawatir mendasar . kami tiba di dusun bambu pada hari jumat , libur panjang , antrian masuk ke dalam lokasi sangat panjang . karena kami menginap , kami tidak dikenakan biaya masuk , tetapi jika hanya akan bermain dan melihat-melihat biaya masuk nya rp 10.000 / orang dan rp 10.000 / mobil .",positive,"dusun bambu , terletak di kaki gunung burangrang . dari terminal ledeng bandung , banyak sekali petunjuk jalan menuju lokasi , sehingga tidak perlu khawatir mendasar . kami tiba di dusun bambu pada hari jumat , libur panjang , antrian masuk ke dalam lokasi sangat panjang . karena kami menginap , kami tidak dikenakan biaya masuk , tetapi jika hanya akan bermain dan melihatmelihat biaya masuk nya rp 10.0 orang dan rp 10.0 mobil .",2,pertamina,2023-05-21
293,293,"letak nya di dago pakar , kalau malam suasana nya sangat bagus , bisa melihat pemandangan bandung , makanan ya standar makanan barat maupun yang tradisional seperti kafe-kafe yang lain .",positive,"letak nya di dago pakar , kalau malam suasana nya sangat bagus , bisa melihat pemandangan bandung , makanan ya standar makanan barat maupun yang tradisional seperti kafekafe yang lain .",2,edukasiempatnol,2023-05-21
294,294,"bukan gubernur nya yang salah tapi presiden nya yang idiot dan tolol . simonyet kowi kan presiden pimpinan tertinggi negara ini , masa tidak bisa mengatur bawahan , logika nya seorang anak kecil mencuri nah yang patut disalahkan orang tua bagaimana cara mendidik dan mengarahkan anak nya dalam hal presiden bagaimana leadership nya kalau dia sendiri juga seorang jongos partai , jadi mental alias jongos nya tidak bakal hilang , solusi nya 2019 coblos capres baru , jokowi buang ke got",negative,"bukan gubernur nya yang salah tapi presiden nya yang idiot dan tolol . simonyet kowi kan presiden pimpinan tertinggi negara ini , masa tidak bisa mengatur bawahan , logika nya seorang anak kecil mencuri nah yang patut disalahkan orang tua bagaimana cara mendidik dan mengarahkan anak nya dalam hal presiden bagaimana leadership nya kalau dia sendiri juga seorang jongos partai , jadi mental alias jongos nya tidak bakal hilang , solusi nya 2019 coblos capres baru , jokowi buang ke got",1,satlantas_solo,2023-07-02
295,295,"bebek nya enak , bumbu nya meresap . ukuran nya besar-besar , puas deh makan nya . untuk kelas resto harga nya tidak terlalu mahal",positive,"bebek nya enak , bumbu nya meresap . ukuran nya besarbesar , puas deh makan nya . untuk kelas resto harga nya tidak terlalu mahal",2,tempodotco,2023-07-31
296,296,"perkara yang buat saya sangat rindu pada kota bandung adalah sate nya yang sangat enak . ternyata sangat rugi sekali bagi tourist yang datang ke bandung , tapi tidak dapat menikmati sate ini . :",positive,"perkara yang buat saya sangat rindu pada kota bandung adalah sate nya yang sangat enak . ternyata sangat rugi sekali bagi tourist yang datang ke bandung , tapi tidak dapat menikmati sate ini .",2,alineadotid,2023-03-07
297,297,"makanan di beehive cukup enak , harga terbilang menengah . beehive juga menyediakan menu makanan barat , indonesia dan makanan penutup dan juice sehat .",positive,"makanan di beehive cukup enak , harga terbilang menengah . beehive juga menyediakan menu makanan barat , indonesia dan makanan penutup dan juice sehat .",2,antaranews_bali,2023-03-29
298,298,kebahagiaan sore ini bisa bertemu dan foto sampai puas sama : sudah ganteng ramah dan baik pula . tidak bosan kandang wajah nya .,positive,kebahagiaan sore ini bisa bertemu dan foto sampai puas sama sudah ganteng ramah dan baik pula . tidak bosan kandang wajah nya .,2,cimsa_yarsi,2023-05-15
299,299,"kalau ke mangkok ayam yang recomended menurut saya adalah nasi goreng nya . porsi nya sih standard untuk 1 orang dan mengenyangkan . minuman nya milo dinausaurus , jadi itu milo dan atas nya dikasih bubuk milo . untuk harga lumayan terjangkau karena ini kan letak nya di mal .",positive,"kalau ke mangkok ayam yang recomended menurut saya adalah nasi goreng nya . porsi nya sih standard untuk 1 orang dan mengenyangkan . minuman nya milo dinausaurus , jadi itu milo dan atas nya dikasih bubuk milo . untuk harga lumayan terjangkau karena ini kan letak nya di mal .",2,2steps_behind_u,2023-10-18
300,300,"positif nya : harga cukup terjangkau , pilihan produk beragam terlebih ada produk ramah terhadap kolestorel . hm . bisa jadi alternatif .",positive,"positif nya harga cukup terjangkau , pilihan produk beragam terlebih ada produk ramah terhadap kolestorel . hm . bisa jadi alternatif .",2,satriaubedgmai1,2023-11-08
301,301,tadinya saya tidak suka ikan . selain bau amis harga nya pun mahal .,negative,tadinya saya tidak suka ikan . selain bau amis harga nya pun mahal .,1,sonorafm92,2023-03-27
302,302,mantap sukses terus untuk,positive,mantap sukses terus untuk,2,aksimui,2023-07-29
303,303,diet napa sih chan ! gue lagi marah,negative,diet napa sih chan ! gue lagi marah,1,jokowibekerjaid,2023-06-09
304,304,baru kali ini saya menikmati makanan sunda . sambal nya enak tidak terlalu pedas . nasi liwet nya juga top markotop !,positive,baru kali ini saya menikmati makanan sunda . sambal nya enak tidak terlalu pedas . nasi liwet nya juga top markotop !,2,mahulumaju,2023-10-13
305,305,ini tontonan acara indonesia semua sudah mulai tidak bermutu ya . apalagi orang-orang yang di dalam acara nya . semua macam tidak bersekolah .,negative,ini tontonan acara indonesia semua sudah mulai tidak bermutu ya . apalagi orangorang yang di dalam acara nya . semua macam tidak bersekolah .,1,mondyjacob,2023-04-03
306,306,"polling pemanasan menuju 2019 backhandindexpointingdown kalau tidak salah polling antara 2013 2014 jokowi selalu berada di posisi puncak dengan unggul jauh dari lawan-lawan nya . nah sekarang jokowi sebagai pertahana menang tipis atas prabowo , bisa jadi 2019 ada presiden baru grinningfacewithbigeyes grinningfacewithbigeyes grinningfacewithbigeyes",neutral,"polling pemanasan menuju 2019 backhandindexpointingdown kalau tidak salah polling antara 2013 2014 jokowi selalu berada di posisi puncak dengan unggul jauh dari lawanlawan nya . nah sekarang jokowi sebagai pertahana menang tipis atas prabowo , bisa jadi 2019 ada presiden baru grinningfacewithbigeyes grinningfacewithbigeyes grinningfacewithbigeyes",0,airpolsek,2023-07-15
307,307,restoran jepang ini cukup terkenal dengan yu tang - nya lidah . sushi nya sekarang banyak macam nya . oven nya kurang enak . pelayanan nya masih perlu diperbaiki . pelayan nya harus lebih ramah .,positive,restoran jepang ini cukup terkenal dengan yu tang nya lidah . sushi nya sekarang banyak macam nya . oven nya kurang enak . pelayanan nya masih perlu diperbaiki . pelayan nya harus lebih ramah .,2,devadevi56,2023-12-01
308,308,"halaman 97 - 128 tidak ada , diulang halaman 65 - 96 , pembelian hari minggu tanggal 24 desember sore sekitar jam 4 pembayaran menggunakan kartu atm bri bersamaan dengan buku the puppeteer dan sirkus pohon",neutral,"halaman 97 128 tidak ada , diulang halaman 65 96 , pembelian hari minggu tanggal 24 desember sore sekitar jam 4 pembayaran menggunakan kartu atm bri bersamaan dengan buku the puppeteer dan sirkus pohon",0,detikhealth,2023-06-30
309,309,"paling enak di sini tahu bodo nya . bagi yang suka pedas , restoran ini menyajikan banyak makanan pedas . ikan solo nya juga enak . lotek nya enak .",positive,"paling enak di sini tahu bodo nya . bagi yang suka pedas , restoran ini menyajikan banyak makanan pedas . ikan solo nya juga enak . lotek nya enak .",2,mizaaan3,2023-08-25
310,310,"suguhan berbagai macam lauk sayur . tinggal pilih , lalu dimasak dan disajikan . pilihan sambal ijo , sambal merah serta lalapan yang banyak . tempat nya juga luas diiringi live musik . mantap deh pokok nya",positive,"suguhan berbagai macam lauk sayur . tinggal pilih , lalu dimasak dan disajikan . pilihan sambal ijo , sambal merah serta lalapan yang banyak . tempat nya juga luas diiringi live musik . mantap deh pokok nya",2,fchkautsar,2023-07-02
311,311,"makanan cukup memuaskan , pelayanan sangat baik dan kebetulan mbak dela sari purnama yang melayani kami , view nya luar biasa , dengan pemandangan kota kota bandung yang trans luxury suguhkan sangat indah dan cocok bersama lama nikmati pemandangan di sini .",positive,"makanan cukup memuaskan , pelayanan sangat baik dan kebetulan mbak dela sari purnama yang melayani kami , view nya luar biasa , dengan pemandangan kota kota bandung yang trans luxury suguhkan sangat indah dan cocok bersama lama nikmati pemandangan di sini .",2,lhprovlampung,2023-07-09
312,312,"saya coba gurame asam manis dan mi goreng , untuk rasa standar , pelayan agak lama padahal kondisi resto tidak terlalu ramai",negative,"saya coba gurame asam manis dan mi goreng , untuk rasa standar , pelayan agak lama padahal kondisi resto tidak terlalu ramai",1,detikcom,2023-06-17
313,313,"bubur nya enak , tempat nya juga nyaman . tetapi dibandingkan dengan banyak nya bubur lainnya di bandung , mungkin menurut saya bubur ini belum masuk top 3 . saran saya , pesan bubur komplit dan kalau akhir pekan cobalah datang sepagi mungkin sebelum penuh .",positive,"bubur nya enak , tempat nya juga nyaman . tetapi dibandingkan dengan banyak nya bubur lainnya di bandung , mungkin menurut saya bubur ini belum masuk top 3 . saran saya , pesan bubur komplit dan kalau akhir pekan cobalah datang sepagi mungkin sebelum penuh .",2,carikeadilandi,2023-01-19
314,314,ini indosat benar-benar perampok pulsa,negative,ini indosat benarbenar perampok pulsa,1,detikcom,2023-08-30
315,315,"kumpul bareng dengan teman-teman eks kuliah di giggle box ternyata merupakan pilihan yang tepat . tempat nya luas , adem , dan pilihan menu nya cukup lengkap dengan kisaran harga 7 sampai 30 ribuan . untuk appetizer , menu fruit salad cocok sebagai makanan pembuka . segar rasanya menikmati potongan apel malang , nanas , apel fuji , honeydew melon dan campuran mayonnaise . apalagi disajikan di atas kulit lumpia yang sudah digoreng . mantap",positive,"kumpul bareng dengan temanteman eks kuliah di giggle box ternyata merupakan pilihan yang tepat . tempat nya luas , adem , dan pilihan menu nya cukup lengkap dengan kisaran harga 7 sampai 30 ribuan . untuk appetizer , menu fruit salad cocok sebagai makanan pembuka . segar rasanya menikmati potongan apel malang , nanas , apel fuji , honeydew melon dan campuran mayonnaise . apalagi disajikan di atas kulit lumpia yang sudah digoreng . mantap",2,kompascom,2023-06-04
316,316,pejuang kemerdekaan lu pikir lu siapa ? dasar tahi pengacau .,negative,pejuang kemerdekaan lu pikir lu siapa ? dasar tahi pengacau .,1,bernamaradio,2023-04-10
317,317,"tidak banyak tempat makan yang enak dan nyaman di dekat stasiun bandung , tapi salah satu yang bisa dicoba adalah paskal makanan market . tinggal naik angkot st . hall - sarijadi / cisitu - tegalega sebentar , lalu turun di depan paskal hyper square . masuk ke dalam paskal hyper square lurus terus , agak jauh , nanti ditemukan . pasal makanan pasar ditata dengan konsep one stop .",positive,"tidak banyak tempat makan yang enak dan nyaman di dekat stasiun bandung , tapi salah satu yang bisa dicoba adalah paskal makanan market . tinggal naik angkot st . hall sarijadi cisitu tegalega sebentar , lalu turun di depan paskal hyper square . masuk ke dalam paskal hyper square lurus terus , agak jauh , nanti ditemukan . pasal makanan pasar ditata dengan konsep one stop .",2,murai_kamilah,2023-06-15
318,318,"perjalanan ke lembang saat itu merayap cukup lama karena lalu lintas begitu padat , perut kami pun sudah mulai minta diisi . nah , ada satu pilihan , yaitu mampir di restoran ini . kami memilih saung lesehan yang membuat kami santai , dari sini kami dapat memantau suasana jalan raya di bawah sana . makan enak sambil menunggu jalan sedikit lenggang .",positive,"perjalanan ke lembang saat itu merayap cukup lama karena lalu lintas begitu padat , perut kami pun sudah mulai minta diisi . nah , ada satu pilihan , yaitu mampir di restoran ini . kami memilih saung lesehan yang membuat kami santai , dari sini kami dapat memantau suasana jalan raya di bawah sana . makan enak sambil menunggu jalan sedikit lenggang .",2,mediabualbual,2023-02-02
319,319,batagor nya enak . sayang karena harga nya cukup mahal dan tidak ada mesin edc antrean menjadi cukup panjang . karena cukup ramai saat liburan,positive,batagor nya enak . sayang karena harga nya cukup mahal dan tidak ada mesin edc antrean menjadi cukup panjang . karena cukup ramai saat liburan,2,wargabanua,2023-01-01
320,320,terong yang digoreng dengan tepung dan juga maskan khas sunda lainnya menurut saya sangat lezat rasanya ditambah pelayanan dari karyawan nya yang cukup baik karena pas saya datang ke sana tempat nya cukup ramai sehingga menunggu ada tempat kosong . cuma untuk yang bawa kendaraan akan cukup sulit mendapat tempat parkir di saat tempat nya ramai apalagi di akhir pekan . tetapi berlebihan ala saya suka dan puas .,positive,terong yang digoreng dengan tepung dan juga maskan khas sunda lainnya menurut saya sangat lezat rasanya ditambah pelayanan dari karyawan nya yang cukup baik karena pas saya datang ke sana tempat nya cukup ramai sehingga menunggu ada tempat kosong . cuma untuk yang bawa kendaraan akan cukup sulit mendapat tempat parkir di saat tempat nya ramai apalagi di akhir pekan . tetapi berlebihan ala saya suka dan puas .,2,ridwankamil,2023-08-04
