,Unnamed: 0,text,sentiment,clean_text,label,username,date
518,518,"tidak tahu juga sih , tetapi melihat masa jabatan bu risma sih sprti nya warga enggan ditinggalkan walikota ini karena suka dengan cara nya bu risma",positive,"tidak tahu juga sih , tetapi melihat masa jabatan bu risma sih sprti nya warga enggan ditinggalkan walikota ini karena suka dengan cara nya bu risma",2,kerupvk,2023-12-25
519,519,"sby telah penuhi syarat tersebut secara manis dan tanpa disadari cukong-cukong , sby berperan besar menyingkirkan ahok berkat sby , ahok kalah di pilkada jakarta 2017 pada - pkb sudah disiapkan jadi pengganti kih . nasdem sudah diintruksikan jr bergabung dengan koalisi pada - pkb untuk usung jokowi - ahy 2019",neutral,"sby telah penuhi syarat tersebut secara manis dan tanpa disadari cukongcukong , sby berperan besar menyingkirkan ahok berkat sby , ahok kalah di pilkada jakarta 2017 pada pkb sudah disiapkan jadi pengganti kih . nasdem sudah diintruksikan jr bergabung dengan koalisi pada pkb untuk usung jokowi ahy 2019",0,binangunnews,2023-05-13
520,520,"dulu aku juga cemburu , tapi malah aku yang di marahin , hmmm jadi serba salah ya",negative,"dulu aku juga cemburu , tapi malah aku yang di marahin , hm jadi serba salah ya",1,borneonews,2023-09-05
521,521,"lokasi dekat stasiun kereta bandung , harga spesial 22 ribu per porsi , rasa mantap patokan dekat hotel arion swisbel di depan nya ada gang dengan tulisan lontong kari",positive,"lokasi dekat stasiun kereta bandung , harga spesial 22 ribu per porsi , rasa mantap patokan dekat hotel arion swisbel di depan nya ada gang dengan tulisan lontong kari",2,sulselinformasi,2023-01-01
522,522,oke . oke . sudah saya kirim via pesan langsung,neutral,oke . oke . sudah saya kirim via pesan langsung,0,kompi4yonbpor,2023-07-19
523,523,enak . andalan untuk makan tengah malam saat di daerah dago . makanan default . donut nya coklat nya enak juga,positive,enak . andalan untuk makan tengah malam saat di daerah dago . makanan default . donut nya coklat nya enak juga,2,kompi4yonbpor,2023-08-22
524,524,"kalau ke bandung tidak sah kalau tidak mampir ke sini . batagor ini memang tidak setenar batagor riri atau yang lainnya , tapi soal rasa sih juara . di sini ada pilihan batagor kering atau kuah . ada juga batagor kering bumbu nya bisa dicampur atau dipisah . saya lebih suka batagor kering dan bumbu nya dipisah . kalau ke sini pasti makan 2 porsi . wajib dicoba .",positive,"kalau ke bandung tidak sah kalau tidak mampir ke sini . batagor ini memang tidak setenar batagor riri atau yang lainnya , tapi soal rasa sih juara . di sini ada pilihan batagor kering atau kuah . ada juga batagor kering bumbu nya bisa dicampur atau dipisah . saya lebih suka batagor kering dan bumbu nya dipisah . kalau ke sini pasti makan 2 porsi . wajib dicoba .",2,muhlisi24905442,2023-09-21
525,525,"classic resto , suka dengan atmosphere restaurant nya dengan menu makanan yang bervariasi mulai masakan indonesia sampai makanan barat ada di sini . harga nya reasonable . lokasi nya di jalan . kidang pananjung , hanya sekitar 20 - 30 meter dengan kawasan simpang dago .",positive,"classic resto , suka dengan atmosphere restaurant nya dengan menu makanan yang bervariasi mulai masakan indonesia sampai makanan barat ada di sini . harga nya reasonable . lokasi nya di jalan . kidang pananjung , hanya sekitar 20 30 meter dengan kawasan simpang dago .",2,802bin,2023-09-16
526,526,ketika pak jokowi bagi-bagi sepeda itu juga adalah pencitraan,negative,ketika pak jokowi bagibagi sepeda itu juga adalah pencitraan,1,satlantasbungo2,2023-11-18
527,527,"malam terakhir di bandung , kami meminta kepada supir agar dibawa ke restoran khas sunda . dia membawa kami ke tempat ini , tempat makan di daerah perumahan yang nyaman . kita dapat memilih bersantap di lantai bawah dengan ruang semi terbuka , atau ke lantai atas . konsep taman kecil indoor membuat bersantap jadi lebih santai . rasa makanan dan minuman nya tidak mengecewakan . kami memesan karedok .",positive,"malam terakhir di bandung , kami meminta kepada supir agar dibawa ke restoran khas sunda . dia membawa kami ke tempat ini , tempat makan di daerah perumahan yang nyaman . kita dapat memilih bersantap di lantai bawah dengan ruang semi terbuka , atau ke lantai atas . konsep taman kecil indoor membuat bersantap jadi lebih santai . rasa makanan dan minuman nya tidak mengecewakan . kami memesan karedok .",2,satlantasbungo2,2023-08-08
528,528,riset kppod pada lima provinsi penyelenggara pilkada 2018 mencatat pelanggaran netralitas asn paling banyak terjadi di media sosial .,neutral,riset kppod pada lima provinsi penyelenggara pilkada 2018 mencatat pelanggaran netralitas asn paling banyak terjadi di media sosial .,0,gpattirajawane,2023-07-18
529,529,rumah makan padang yang enak banget pas buat rehat setelah melakukan perjalanan dari jakarta . menu nya lengkap banget ciri restoran padang hanya saja harga nya lebih mahal dari rumah makan padang biasa . tapi soal rasa menang dan juara,positive,rumah makan padang yang enak banget pas buat rehat setelah melakukan perjalanan dari jakarta . menu nya lengkap banget ciri restoran padang hanya saja harga nya lebih mahal dari rumah makan padang biasa . tapi soal rasa menang dan juara,2,syifa14167579,2023-03-09
530,530,"enak banget daging nya , pelayanan nya juga oke , namun sayang sekali tempat nya sedikit kecil , jadi kalau lagi banyak orang yang makan dilokasi , bakalan cukup lama untuk dapat duduk dan memesan makanan",positive,"enak banget daging nya , pelayanan nya juga oke , namun sayang sekali tempat nya sedikit kecil , jadi kalau lagi banyak orang yang makan dilokasi , bakalan cukup lama untuk dapat duduk dan memesan makanan",2,me__yudis,2023-02-14
531,531,"makanan banyak pilihan , tempat nyaman , hiburan di kafe banyak , hidangan enak di pandang dan di rasa . akses gampang di daerah keramaian",positive,"makanan banyak pilihan , tempat nyaman , hiburan di kafe banyak , hidangan enak di pandang dan di rasa . akses gampang di daerah keramaian",2,enno_setyono,2023-04-12
532,532,"belum lengkap rasanya jika pergi ke bandung tidak mencoba makan siomay di sini , rasanya siomay nya lezat dan kenyal , bumbu nya sangat enak dan cocok dengan siomay nya .",positive,"belum lengkap rasanya jika pergi ke bandung tidak mencoba makan siomay di sini , rasanya siomay nya lezat dan kenyal , bumbu nya sangat enak dan cocok dengan siomay nya .",2,lensaposti,2023-10-29
533,533,jokowi rendah hati,positive,jokowi rendah hati,2,prokompimblitar,2023-07-19
534,534,"design interior kafe ini sangat menarik dengan presentasi dari inggris , makanan nya agak mahal tapi rasanya enak .",positive,"design interior kafe ini sangat menarik dengan presentasi dari inggris , makanan nya agak mahal tapi rasanya enak .",2,propertynbank_,2023-05-27
535,535,"sudah minimal jangan nge - iklan melulu , mending kamu ngurusin itu internet yang lemon ! dasar !",negative,"sudah minimal jangan nge iklan melulu , mending kamu ngurusin itu internet yang lemon ! dasar !",1,reslstyn_,2023-07-01
536,536,hari minggu ya panjang dan melelahkan,negative,hari minggu ya panjang dan melelahkan,1,ajimuharaam,2023-07-18
537,537,"diterpa isu miring , pdip belum terpikir mengganti anas",neutral,"diterpa isu miring , pdip belum terpikir mengganti anas",0,supremanadarp,2023-01-29
538,538,mereka yang masih pakai kata tiko . adalah mereka yang kehidupan nya juga suram . jangan lu pikir mereka mapan ekonomi terus hidup mereka bahagia . kusut-kusut juga . harus nya semua orang bisa nilailah orang-orang yang masih pakai kata-kata tiko . lu teriak-teriak cina bangsat . sama saja bukan ?,negative,mereka yang masih pakai kata tiko . adalah mereka yang kehidupan nya juga suram . jangan lu pikir mereka mapan ekonomi terus hidup mereka bahagia . kusutkusut juga . harus nya semua orang bisa nilailah orangorang yang masih pakai katakata tiko . lu teriakteriak cina bangsat . sama saja bukan ?,1,polsekbesuki86,2023-05-18
539,539,"siram pakai cuko saja itu orang , dasar ambon anjing . ambon tidak ada apa-apa nya bagi kami orang palembang , mati saja kau di tusuk sama budak palembang .",negative,"siram pakai cuko saja itu orang , dasar ambon anjing . ambon tidak ada apaapa nya bagi kami orang palembang , mati saja kau di tusuk sama budak palembang .",1,drtaufan1,2023-09-04
540,540,"kami setiap ke bandung selalu mampir untuk makan saat malam hari , karena dekat juga dengan tempat penginapan kami di daerah dipanegoro . , makan di alas daun enak banget rasanya , unik dengan menggunakan alas daun , rasanya enak-enak semua dari yang ikan gurame bakar , ayam bakar , ayam goreng lalapan dan sayur asem nya enak , sambel nya juga mantap bisa menambah tinggal ambil sendiri .",positive,"kami setiap ke bandung selalu mampir untuk makan saat malam hari , karena dekat juga dengan tempat penginapan kami di daerah dipanegoro . , makan di alas daun enak banget rasanya , unik dengan menggunakan alas daun , rasanya enakenak semua dari yang ikan gurame bakar , ayam bakar , ayam goreng lalapan dan sayur asem nya enak , sambel nya juga mantap bisa menambah tinggal ambil sendiri .",2,gpattirajawane,2023-06-21
541,541,"makanan nya mahal , cuma pemandangan nya saja keren . makan saja harus daftar tunggu , servis nya lama , cuma nya ramah sih , makan nya di pondok-pondok begitu alias saung gituw . ada aer terjun nya .",positive,"makanan nya mahal , cuma pemandangan nya saja keren . makan saja harus daftar tunggu , servis nya lama , cuma nya ramah sih , makan nya di pondokpondok begitu alias saung gituw . ada aer terjun nya .",2,gpattirajawane,2023-08-24
542,542,"tempat yang bagus untuk makan malam , sangat bagus pemandangan , sangat bagus rasa , sangat bagus staf . hanya bagus . makan malam dengan suami berdua candle light makan malam , staff nya ramah banget layanan super duper cepat , makanan nya juga enak , harga lumayan tetapi setimpal banget sama yang didapat .",positive,"tempat yang bagus untuk makan malam , sangat bagus pemandangan , sangat bagus rasa , sangat bagus staf . hanya bagus . makan malam dengan suami berdua candle light makan malam , staff nya ramah banget layanan super duper cepat , makanan nya juga enak , harga lumayan tetapi setimpal banget sama yang didapat .",2,ana_hutagalung,2023-12-21
543,543,resto cukup bersih dan menyediakan tempat ibadah yang bersih . menu khas sunda dan sangat cocok untuk penggemar berbagai jenis sambal,positive,resto cukup bersih dan menyediakan tempat ibadah yang bersih . menu khas sunda dan sangat cocok untuk penggemar berbagai jenis sambal,2,mugiarso74,2023-02-25
544,544,"dusun bambu adalah sarana rekreasi yang wajib dikunjungi apabila ke bandung . tempat nya sangat indah dan sejuk , serta bersih . namun harga makanan di sini cukup mahal , dibandingkan kualitas makanan nya . mungkin harga makanan dibebani dengan harga tempat yang bagus ini .",positive,"dusun bambu adalah sarana rekreasi yang wajib dikunjungi apabila ke bandung . tempat nya sangat indah dan sejuk , serta bersih . namun harga makanan di sini cukup mahal , dibandingkan kualitas makanan nya . mungkin harga makanan dibebani dengan harga tempat yang bagus ini .",2,pksjateng,2023-11-29
545,545,"tingkatkan pertumbuhan ekonomi , pemerintah terus bangun infrastruktur transportasi hingga pelosok negeri",positive,"tingkatkan pertumbuhan ekonomi , pemerintah terus bangun infrastruktur transportasi hingga pelosok negeri",2,subohpolsek,2023-02-14
546,546,kami warga riau sakit hati dibilang anti pancasila oleh oknum padahal saham terbesar pejuang kemerdekaan bangsa nkri adalah mayoritas umat muslim ayo warga riau laporkan oknum tersebut . ke polda masing-masing,negative,kami warga riau sakit hati dibilang anti pancasila oleh oknum padahal saham terbesar pejuang kemerdekaan bangsa nkri adalah mayoritas umat muslim ayo warga riau laporkan oknum tersebut . ke polda masingmasing,1,roren_pertanian,2023-09-06
547,547,"ajaran kristen mah tidak masuk akal , patung saja disembah .",negative,"ajaran kristen mah tidak masuk akal , patung saja disembah .",1,sekmako,2023-03-17
548,548,"ya , lebih dari kopi , bukan sekedar kopi , dan tidak hanya kopi . di kopi progo , kita akan merasakan sebuah tempat hang out yang oke , nyaman , dan ini adalah tempat yang hit bagi warga kota bandung . di sini tersedia wifi pula . menu nya sendiri bermacam-macam . mulai kopi khas nya , aneka minuman dingin seperti smoothies , makanan berat dari nasi goreng sampai steak semuanya enak .",positive,"ya , lebih dari kopi , bukan sekedar kopi , dan tidak hanya kopi . di kopi progo , kita akan merasakan sebuah tempat hang out yang oke , nyaman , dan ini adalah tempat yang hit bagi warga kota bandung . di sini tersedia wifi pula . menu nya sendiri bermacammacam . mulai kopi khas nya , aneka minuman dingin seperti smoothies , makanan berat dari nasi goreng sampai steak semuanya enak .",2,satlantasbungo2,2023-01-23
549,549,"menu variatif seperti rempah pedas mantap . nama menu unik ada nasi gorng triad , gengster , brandal . suka pokok nya sama nasi goreng mafia .",positive,"menu variatif seperti rempah pedas mantap . nama menu unik ada nasi gorng triad , gengster , brandal . suka pokok nya sama nasi goreng mafia .",2,politiklingkar,2023-03-03
550,550,"anggota fpi ditahan usai tangkap pengedar psikotropika , polisi dinilai salah sasaran",neutral,"anggota fpi ditahan usai tangkap pengedar psikotropika , polisi dinilai salah sasaran",0,satlantasbungo2,2023-06-14
551,551,"bahan baku mie sebenarnya biasa saja , tapi karena di olah profesional jadi enak . banyak varian , kreatif pokok nya keep it upnormal",positive,"bahan baku mie sebenarnya biasa saja , tapi karena di olah profesional jadi enak . banyak varian , kreatif pokok nya keep it upnormal",2,p_sungaikakap,2023-02-09
552,552,"kafe bergaya klasik ini menyajikan makanan padat yang lezat , bersama keluargalah yang anda pantas untuk ku njungi , sebagian besar suka dengan makanan di sini . berkunjunglah dengan keluarga atau kerabat anda supaya kita merasakan kenikmatann nya .",positive,"kafe bergaya klasik ini menyajikan makanan padat yang lezat , bersama keluargalah yang anda pantas untuk ku njungi , sebagian besar suka dengan makanan di sini . berkunjunglah dengan keluarga atau kerabat anda supaya kita merasakan kenikmatann nya .",2,disasterdotco,2023-12-19
553,553,"halo selamat pagi ! indosat itu memang sengaja atau bagaimana ya , ada pelanggan komplet kok di biarkan saja ! bodoh banget ! pulsa saya sering hilang ! sinyal hilang hilang , parah ! bikin kecewa tiap hari nya , tolong dong di perbaiki , masa kalah sama 3 three ! jejak !",negative,"halo selamat pagi ! indosat itu memang sengaja atau bagaimana ya , ada pelanggan komplet kok di biarkan saja ! bodoh banget ! pulsa saya sering hilang ! sinyal hilang hilang , parah ! bikin kecewa tiap hari nya , tolong dong di perbaiki , masa kalah sama 3 three ! jejak !",1,fisioterapiunud,2023-12-21
554,554,"menu nya sunda dengan aneka pilihan lauk dan sambal , lalapan nya juga segar banget dan sambal nya yang jago . mantap banget",positive,"menu nya sunda dengan aneka pilihan lauk dan sambal , lalapan nya juga segar banget dan sambal nya yang jago . mantap banget",2,prokomkukar,2023-09-11
555,555,"kalau dibandingkan dengan harga nya ini adalah steak yang luar biasa . 23 ribu sudah dapat steak ayam dobel 2 filet ayam cukup besar . jus mix fruit nya segar , 10 ribuan . untuk menu standar plus minum dengan 50 ribu , cukup buat berdua . parkir luas , tak sedekat sekali jalan tempat makan lain di dipatiukur . mau bersama-bersama juga tidak diusir .",positive,"kalau dibandingkan dengan harga nya ini adalah steak yang luar biasa . 23 ribu sudah dapat steak ayam dobel 2 filet ayam cukup besar . jus mix fruit nya segar , 10 ribuan . untuk menu standar plus minum dengan 50 ribu , cukup buat berdua . parkir luas , tak sedekat sekali jalan tempat makan lain di dipatiukur . mau bersamabersama juga tidak diusir .",2,polsektelaga1,2023-08-05
556,556,menemukan tempat makan ini secara tidak sengaja ketika melintasi jalan talaga bodas di bandung . dan sejak itu selalu kembali ke sini setiap ke bandung . mi buatan sendiri yang kecil-kecil dan halus sangat enak dipadu ayam racikan nya . saya lebih suka yamin sedang namun bakmi kuah juga tak kalah enak . tempat ini buka dari pagi sampai jam 10 malam .,positive,menemukan tempat makan ini secara tidak sengaja ketika melintasi jalan talaga bodas di bandung . dan sejak itu selalu kembali ke sini setiap ke bandung . mi buatan sendiri yang kecilkecil dan halus sangat enak dipadu ayam racikan nya . saya lebih suka yamin sedang namun bakmi kuah juga tak kalah enak . tempat ini buka dari pagi sampai jam 10 malam .,2,polsektelaga1,2023-06-20
557,557,untuk ukuran mi kangkung ini cukup enak tapi harganua kemahalan rp 42 ribu untuk makan mie ini . saya rekomendasikan makan mohon maaf non halal kaki lima di sebelah kanan mi karuhun nama nya nasi campur . yang nasi campur ini patut dicoba bagi penghobi non halal .,positive,untuk ukuran mi kangkung ini cukup enak tapi harganua kemahalan rp 42 ribu untuk makan mie ini . saya rekomendasikan makan mohon maaf non halal kaki lima di sebelah kanan mi karuhun nama nya nasi campur . yang nasi campur ini patut dicoba bagi penghobi non halal .,2,polsektelaga1,2023-04-26
558,558,sepertinya orang indonesia sudah mulai bosan melihat sinetron,negative,sepertinya orang indonesia sudah mulai bosan melihat sinetron,1,polsektelaga1,2023-09-17
559,559,"berkumpul di sini malam-malam direkomendasikan deh . tempat nya unik , tradisional sekali . pelayanan nya juga ramah .",positive,"berkumpul di sini malammalam direkomendasikan deh . tempat nya unik , tradisional sekali . pelayanan nya juga ramah .",2,antarajatimcom,2023-04-11
560,560,kinerja buruk menteri ganggu elektabilitas jokowi,negative,kinerja buruk menteri ganggu elektabilitas jokowi,1,polsektelaga1,2023-09-15
561,561,"salah satu makanan enak di bandung untuk khas makanan bubur adalah bubur ayam hamid , tempat nya bersih , ramah serta lumayan terjangkau harga nya .",positive,"salah satu makanan enak di bandung untuk khas makanan bubur adalah bubur ayam hamid , tempat nya bersih , ramah serta lumayan terjangkau harga nya .",2,polsektelaga1,2023-11-08
562,562,"menjaga nu tidak pecah di jatim , yenny wahid tolak tawaran prabowo subianto lewat",neutral,"menjaga nu tidak pecah di jatim , yenny wahid tolak tawaran prabowo subianto lewat",0,polsektelaga1,2023-12-13
563,563,"kafe ini terletak d daerah dago atas , suasana di sini sungguh nyaman tenang , dingin dan santai . mereka menyediakan beberapa menu makanan dari mulai appetizer sampai makanan penutup , harga yang diberikan pun cocok dengan apa yang anda dapatkan . tersedia tempat duduk sofa dan beberapa kursi kayu d dalam nya . sungguh tempat yang nyaman .",positive,"kafe ini terletak d daerah dago atas , suasana di sini sungguh nyaman tenang , dingin dan santai . mereka menyediakan beberapa menu makanan dari mulai appetizer sampai makanan penutup , harga yang diberikan pun cocok dengan apa yang anda dapatkan . tersedia tempat duduk sofa dan beberapa kursi kayu d dalam nya . sungguh tempat yang nyaman .",2,polsektelaga1,2023-08-25
564,564,"tempat rekreasi yang cukup bagus untuk pergi bersama keluarga . ada tempat main anak-anak , ada taman yang indah , dan tempat makan yang cukup banyak . lingkungan yang asri dan menyenangkan .",positive,"tempat rekreasi yang cukup bagus untuk pergi bersama keluarga . ada tempat main anakanak , ada taman yang indah , dan tempat makan yang cukup banyak . lingkungan yang asri dan menyenangkan .",2,polsektelaga1,2023-01-18
565,565,"the harvest ini setahu saya sudah ada beberapa cabang di kota lain . untuk tempat nya terkesan elegan dan mewah , di sini juga kita bisa makan di restoran nya . kue nya yang paling enak tiramissu , kopi dan kue nya bersatu dan enak banget . untuk harga lumayan mahal sih , satu kue sedang harga nya 200 - 250 ribu , tapi boleh dicoba kalau kalian memang penggemar tiramissu , worth it .",positive,"the harvest ini setahu saya sudah ada beberapa cabang di kota lain . untuk tempat nya terkesan elegan dan mewah , di sini juga kita bisa makan di restoran nya . kue nya yang paling enak tiramissu , kopi dan kue nya bersatu dan enak banget . untuk harga lumayan mahal sih , satu kue sedang harga nya 200 250 ribu , tapi boleh dicoba kalau kalian memang penggemar tiramissu , worth it .",2,deri_oncom,2023-02-01
566,566,setuju bang ruhut . fahri hamzah itu biang kerok negara . betapa bodoh nya pks mempertahankan bangsat ini . sama kayak gerindra mempertahankan fadli zon si bangsat,negative,setuju bang ruhut . fahri hamzah itu biang kerok negara . betapa bodoh nya pks mempertahankan bangsat ini . sama kayak gerindra mempertahankan fadli zon si bangsat,1,polsektelaga1,2023-02-17
567,567,"jika ke bandung , saya merasa belum lengkap jika tidak menikmati makanan di kedai nyonya rumah . dan entah mengapa , saya selalu memilih ke jalan trunojoyo daripada naripan . tanggal 31 mei 2016 lalu , pramusaji merekomendasikan nasi garang asam iga . karena saya tidak mengonsumsi daging sapi , menu andalan tersebut akhirnya menjadi pilihan suami . teman yang menemani kami ke bandung langsung memilih nasi pepes .",positive,"jika ke bandung , saya merasa belum lengkap jika tidak menikmati makanan di kedai nyonya rumah . dan entah mengapa , saya selalu memilih ke jalan trunojoyo daripada naripan . tanggal 31 mei 2016 lalu , pramusaji merekomendasikan nasi garang asam iga . karena saya tidak mengonsumsi daging sapi , menu andalan tersebut akhirnya menjadi pilihan suami . teman yang menemani kami ke bandung langsung memilih nasi pepes .",2,polsektelaga1,2023-12-24
568,568,bangga sama polisi indonesia yang sukses mengamankan arus mudik kemarin,positive,bangga sama polisi indonesia yang sukses mengamankan arus mudik kemarin,2,polsektelaga1,2023-10-08
569,569,"berat rasanya kembali ketempat ini , sungguh sudah sangat bosan dan jenuh",negative,"berat rasanya kembali ketempat ini , sungguh sudah sangat bosan dan jenuh",1,frzarrfly_,2023-04-14
570,570,ini gerakan mahasiswa di indonesia pasti ada dukungan dari belakang . mana mungkin mahasiswa punya nyali untuk mendemo pemerintahan . mahasiswa kerjaan nya cuma belajar saja . tahu politik saja pun tidak .,negative,ini gerakan mahasiswa di indonesia pasti ada dukungan dari belakang . mana mungkin mahasiswa punya nyali untuk mendemo pemerintahan . mahasiswa kerjaan nya cuma belajar saja . tahu politik saja pun tidak .,1,polsektelaga1,2023-07-10
571,571,"kalau lagi ingin makan makanan sunda , pasti ke sini . tempat nya bernuansa sunda , makanan nya juga enak-enak . paling suka sama sop ikan gurame kuah merah sama ayam ungkep nya . mantap dah : d instagram : sharetheyumz",positive,"kalau lagi ingin makan makanan sunda , pasti ke sini . tempat nya bernuansa sunda , makanan nya juga enakenak . paling suka sama sop ikan gurame kuah merah sama ayam ungkep nya . mantap dah d instagram sharetheyumz",2,polsektelaga1,2023-09-05
572,572,pakai bambu . memalukan sekali dki jakarta sebagai ibu kota negara gubernur nya sudah mengecewakan memang nya ini di yaman tempat moyang nya wan abud ? .. kas apbd ke mana ?,negative,pakai bambu . memalukan sekali dki jakarta sebagai ibu kota negara gubernur nya sudah mengecewakan memang nya ini di yaman tempat moyang nya wan abud ? .. kas apbd ke mana ?,1,tuarudi,2023-08-22
573,573,"bakmi ini enak banget , hanya saja di sana juga tersedia hidangan non halal bagi muslim . aneka bakmi , bakso dan pangsit cocok untuk sarapan , makan siang atau makan malam .",positive,"bakmi ini enak banget , hanya saja di sana juga tersedia hidangan non halal bagi muslim . aneka bakmi , bakso dan pangsit cocok untuk sarapan , makan siang atau makan malam .",2,hulubilah,2023-08-16
574,574,"suasana makan di alam bebas yang di sekeliling nya terdapat pohon stroberi , makanan yang disajikan , makanan khas sunda seperti nasi tutug oncom , nasi timbel , ikan gurame dan lain-lain",positive,"suasana makan di alam bebas yang di sekeliling nya terdapat pohon stroberi , makanan yang disajikan , makanan khas sunda seperti nasi tutug oncom , nasi timbel , ikan gurame dan lainlain",2,polsektelaga1,2023-03-10
575,575,"suasana dingin-dingin di bandung , paling enak kuliner nya ya makan makanan yang hangat-hangat . kalau ada sedang kecapean mengitari museum pos indonesia di bandung , museum geologi , gedung sate dan taman lansia , arahkan sedikit ke arah pusdai untuk menikmati enak nya bakso dari kota dingin di jawa timur . bakso , merupakan salah satu masakan khas dari kota malang yang sangat disuka dan dicari .",positive,"suasana dingindingin di bandung , paling enak kuliner nya ya makan makanan yang hangathangat . kalau ada sedang kecapean mengitari museum pos indonesia di bandung , museum geologi , gedung sate dan taman lansia , arahkan sedikit ke arah pusdai untuk menikmati enak nya bakso dari kota dingin di jawa timur . bakso , merupakan salah satu masakan khas dari kota malang yang sangat disuka dan dicari .",2,polsektelaga1,2023-12-25
576,576,"nyobain mi bebek rasanya enak , banyak pilihan menu dan harga lumayan terjangkau tidak begitu mahal . setiap belanja di stia budi pasti beres nya makan di mangkok ayam :",positive,"nyobain mi bebek rasanya enak , banyak pilihan menu dan harga lumayan terjangkau tidak begitu mahal . setiap belanja di stia budi pasti beres nya makan di mangkok ayam",2,ayukdd_,2023-09-24
