,Unnamed: 0,text,sentiment,clean_text,label,username,date
0,0,"meski masa kampanye sudah selesai , bukan berati habis pula upaya mengerek tingkat kedipilihan elektabilitas .",neutral,"meski masa kampanye sudah selesai , bukan berati habis pula upaya mengerek tingkat kedipilihan elektabilitas .",0,monologis_id,2023-02-15
1,1,tidak enak,negative,tidak enak,1,its_dul,2023-12-27
2,2,"restoran ini menawarkan makanan sunda . kami memesan ayam goreng , kangkung , sayur asam , ikan gurame goreng , ikan bakar , nasi goreng , karedok , tahu tempe , nasi putih , nasi merah etc minuman yang mereka tawarkan juga cukup variatif . rasa makanan enak dan harga murah . kami 9 dewasa dan 5 anak kecil , hanya menghabiskan 800,000",positive,"restoran ini menawarkan makanan sunda . kami memesan ayam goreng , kangkung , sayur asam , ikan gurame goreng , ikan bakar , nasi goreng , karedok , tahu tempe , nasi putih , nasi merah etc minuman yang mereka tawarkan juga cukup variatif . rasa makanan enak dan harga murah . kami 9 dewasa dan 5 anak kecil , hanya menghabiskan 800,0",2,meonkbaong,2023-10-29
3,3,"lokasi di alun alun masakan padang ini cukup terkenal dengan kepala ikan kakap gule , biasa saya pesan nasi bungkus padang berisikan rendang , ayam pop dan perkedel . porsi banyak dan mengenyangkan",positive,"lokasi di alun alun masakan padang ini cukup terkenal dengan kepala ikan kakap gule , biasa saya pesan nasi bungkus padang berisikan rendang , ayam pop dan perkedel . porsi banyak dan mengenyangkan",2,rakyatdotnews,2023-04-12
4,4,"betapa bejad kader gerindra yang anggota dprd mencabuli anak smp , rakyat harus cerdas partai mana yang harus di tengelamkan di 2019",negative,"betapa bejad kader gerindra yang anggota dprd mencabuli anak smp , rakyat harus cerdas partai mana yang harus di tengelamkan di 2019",1,annisathalib_,2023-10-02
5,5,"kampiun bistro berada di jalan . kebon kawung , sebelah kanan seberang stasiun kota bandung . harga makanan dan minuman nya sangat terjangkau . ada live musik juga . dan kalau beruntung , anda akan bertemu dengan yuke dewa19 di tempat ini .",positive,"kampiun bistro berada di jalan . kebon kawung , sebelah kanan seberang stasiun kota bandung . harga makanan dan minuman nya sangat terjangkau . ada live musik juga . dan kalau beruntung , anda akan bertemu dengan yuke dewa19 di tempat ini .",2,prosesnewsid,2023-02-07
6,6,kamar nya sempit tidak ada tempat menyimpan barang malah menambah barang . by the way ini kipas2 mau diletakkan mana . mana uchiwa segede ini pula .,negative,kamar nya sempit tidak ada tempat menyimpan barang malah menambah barang . by the way ini kipas2 mau diletakkan mana . mana uchiwa segede ini pula .,1,midhopaulo14,2023-03-15
7,7,"saya tadi mampir ke restauran ini , mungkin letak nya strategis , pertama masuk dikasih senyuman manis sama mbak yang ramah , di situ pun saya memesan chiken grill , es thai tea dan super duper ice cream . enak . saya suka .",positive,"saya tadi mampir ke restauran ini , mungkin letak nya strategis , pertama masuk dikasih senyuman manis sama mbak yang ramah , di situ pun saya memesan chiken grill , es thai tea dan super duper ice cream . enak . saya suka .",2,kpu_magetan,2023-10-14
8,8,jangan percaya dengan agama buddha . agama itu saja tidak punya tuhan . agama sesat itu .,negative,jangan percaya dengan agama buddha . agama itu saja tidak punya tuhan . agama sesat itu .,1,bangaceng88,2024-01-01
9,9,kafe ini menawarkan sesuatu hal yang sebelumnya saya tak suka tapi akhirnya saya bisa rekomendasi karena enak rasanya yaitu terong goreng ! di sini saya baru bisa menikmati terong yang diolah sehingga terasa lezat :,positive,kafe ini menawarkan sesuatu hal yang sebelumnya saya tak suka tapi akhirnya saya bisa rekomendasi karena enak rasanya yaitu terong goreng ! di sini saya baru bisa menikmati terong yang diolah sehingga terasa lezat,2,kasehsaulmouk,2023-10-30
10,10,yusri seorang ibu yang tidak tahu diri . sudah tidak punya uang mebel lagi . melihat muka ibu dikaca . sudah dibantu tidak terima kasih . dasar maling .,negative,yusri seorang ibu yang tidak tahu diri . sudah tidak punya uang mebel lagi . melihat muka ibu dikaca . sudah dibantu tidak terima kasih . dasar maling .,1,nadyathara,2023-02-27
11,11,menemukan bocah-bocah sampai yang komentar di yutub pakai kata-kata kotor begitu . yang mengajarkan siapa dah ? sedih :,negative,menemukan bocahbocah sampai yang komentar di yutub pakai katakata kotor begitu . yang mengajarkan siapa dah ? sedih,1,ramachw_,2023-01-16
12,12,indomaret adalah penjahat anyar dalam dunia perdagangan,negative,indomaret adalah penjahat anyar dalam dunia perdagangan,1,trans7,2023-06-04
13,13,"malah .. !!! tren si tukang fitnah bicara iman , dasar akun sapi yang takut kehilangan kursi cawapres prabowo makanya busukkan nama ahy dan say",negative,"malah .. ! tren si tukang fitnah bicara iman , dasar akun sapi yang takut kehilangan kursi cawapres prabowo makanya busukkan nama ahy dan say",1,zyghozy,2023-07-06
14,14,"tahun 2018 , bri ingin akuisisi 2 bank cilik",neutral,"tahun 2018 , bri ingin akuisisi 2 bank cilik",0,infonyamks,2023-05-05
15,15,pilihan bakso nya sangat beragam dan kelebihan nya adalah kita bebas memilih jenis dan jumlah bakso yang kita inginkan,positive,pilihan bakso nya sangat beragam dan kelebihan nya adalah kita bebas memilih jenis dan jumlah bakso yang kita inginkan,2,suaradotcom,2023-02-03
16,16,"dulu mau modalin , sediakan tempat , dan carikan pembeli . kok sekarang sindir warga zaman now bergantung pada pemerintah . tidak jelas banget .",negative,"dulu mau modalin , sediakan tempat , dan carikan pembeli . kok sekarang sindir warga zaman now bergantung pada pemerintah . tidak jelas banget .",1,akuratco,2023-10-08
17,17,"tempa nya sangat memanjakan pengunjung . dengan suasana pedesaan , banyak nya pohon-pohon menambang kesejukan di tempat ini . tapi , pengunjung memang harus siap dengan harga makanan dan minuman yang diperjualbelikan di sini",positive,"tempa nya sangat memanjakan pengunjung . dengan suasana pedesaan , banyak nya pohonpohon menambang kesejukan di tempat ini . tapi , pengunjung memang harus siap dengan harga makanan dan minuman yang diperjualbelikan di sini",2,asli_wni,2023-10-14
18,18,"musnahkan lgbt , gay , homo , dan lesbian dari muka bumi ini . ancaman terbesar untuk umat manusia dibumi . jika dibiarkan manusia akan punah .",negative,"musnahkan lgbt , gay , homo , dan lesbian dari muka bumi ini . ancaman terbesar untuk umat manusia dibumi . jika dibiarkan manusia akan punah .",1,anthonraharusu4,2023-08-18
19,19,"banyak pilihan menu khas bakso , bakso rawit dan bakso granat yang pedas , dan sop iga nya mantap , dengan banyak pilihan minuman , yang saya suka adalah rainbow jely",positive,"banyak pilihan menu khas bakso , bakso rawit dan bakso granat yang pedas , dan sop iga nya mantap , dengan banyak pilihan minuman , yang saya suka adalah rainbow jely",2,al_fa_07,2023-12-27
20,20,"piring kaleng , gelas kaleng , makanan rumahan , es cincau , dan yang terpenting , cumi masak hitam yang tak terkalahkan oleh rumah makan di mana pun . makan ala prasmanan dengan pilihan nasi merah yang cocok bagi pelaku diet , barisan lauk pauk yang bisa kita pilih semau nya , pilihan sambal dan lalapan yang bisa diambil sebanyak kita mau , dan harga yang sangat ramah kantong .",positive,"piring kaleng , gelas kaleng , makanan rumahan , es cincau , dan yang terpenting , cumi masak hitam yang tak terkalahkan oleh rumah makan di mana pun . makan ala prasmanan dengan pilihan nasi merah yang cocok bagi pelaku diet , barisan lauk pauk yang bisa kita pilih semau nya , pilihan sambal dan lalapan yang bisa diambil sebanyak kita mau , dan harga yang sangat ramah kantong .",2,nano_daru,2023-07-09
21,21,"pertama datang ke sini karena rekomendasi dari medsos . tertarik melihat minuman dengan aromanis diatas nya dan kue cantik lainnya . tempat nya di lantai 3 mayfair building . jangan sampai kelewat ya , karena pertama ke sana cukup kesulitan . begitu masuk ke tempat nya kata yang terlintas adalah manis . mulai dari dekorasi dan konsep yang diterapkan sampai menu makanan nya .",positive,"pertama datang ke sini karena rekomendasi dari medsos . tertarik melihat minuman dengan aromanis diatas nya dan kue cantik lainnya . tempat nya di lantai 3 mayfair building . jangan sampai kelewat ya , karena pertama ke sana cukup kesulitan . begitu masuk ke tempat nya kata yang terlintas adalah manis . mulai dari dekorasi dan konsep yang diterapkan sampai menu makanan nya .",2,pwanea,2023-02-16
22,22,senang nya pakai kartu,positive,senang nya pakai kartu,2,alifdutah,2023-04-29
23,23,trans corp kembali berniat membuka transmart,neutral,trans corp kembali berniat membuka transmart,0,adisaplex,2023-01-16
24,24,: kalau subscriber youtube netmediatama mencapai 1 juta .,neutral,kalau subscriber youtube netmediatama mencapai 1 juta .,0,dngilawajan,2023-03-02
25,25,gue bingung sama pemerintahan jokowi . banyak orang yang muji dia padahal dia cuma bisa merusak negara kita saja . aneh,negative,gue bingung sama pemerintahan jokowi . banyak orang yang muji dia padahal dia cuma bisa merusak negara kita saja . aneh,1,11desember78,2023-08-21
26,26,"kalau melihat desain nya pixel 3 sih biasa saja , tapi iklan nya ini bagus banget sampai bikin barang nya jadi terlihat wah banget",positive,"kalau melihat desain nya pixel 3 sih biasa saja , tapi iklan nya ini bagus banget sampai bikin barang nya jadi terlihat wah banget",2,kominfokabkdr,2023-09-21
27,27,"menu-menu tradisional sunda dengan tempat dan wadah yang unik makanan nya banyak ragam minuman dan makanan khas sunda yang jarang dijumpai di luar , ternyata ada di sini .",positive,"menumenu tradisional sunda dengan tempat dan wadah yang unik makanan nya banyak ragam minuman dan makanan khas sunda yang jarang dijumpai di luar , ternyata ada di sini .",2,jojo8890475283,2023-10-05
28,28,"ampera benhil . pegawai judes , banyak asap rokok , kotor . ini cabang ampera yang paling mengecewakan .",negative,"ampera benhil . pegawai judes , banyak asap rokok , kotor . ini cabang ampera yang paling mengecewakan .",1,salsabilameiza1,2023-11-20
29,29,salut,positive,salut,2,ibnupurna,2023-11-19
30,30,"makanan nya enak , porsi nya lumayan banyak , suasana nya juga enak , di tengah nya ada taman dan bergaya zaman dulu , pada waktu datang dikasih roti untuk makanan pembuka",positive,"makanan nya enak , porsi nya lumayan banyak , suasana nya juga enak , di tengah nya ada taman dan bergaya zaman dulu , pada waktu datang dikasih roti untuk makanan pembuka",2,chhrygrl,2023-10-06
31,31,sangat tidak profesional institusi . hanya membuat kecewa dan sangat tidak rapi anda bermain . kalau mau main rapi jangan ada kotor sedikit pun,negative,sangat tidak profesional institusi . hanya membuat kecewa dan sangat tidak rapi anda bermain . kalau mau main rapi jangan ada kotor sedikit pun,1,siregar_mohamad,2023-12-05
32,32,"sejak jokwi naik jadi presiden , simbol-simbol pki tumbuh subur tanpa henti seolah tak ada pihak yang berdaya memberangus hal tersebut . selaku presiden , omongan gebuk pki tak lebih hanya pembohongan publik",negative,"sejak jokwi naik jadi presiden , simbolsimbol pki tumbuh subur tanpa henti seolah tak ada pihak yang berdaya memberangus hal tersebut . selaku presiden , omongan gebuk pki tak lebih hanya pembohongan publik",1,rudehellokitty,2023-09-28
33,33,"demo , inilah permintaan nelayan pamekasan kepada menteri susi",neutral,"demo , inilah permintaan nelayan pamekasan kepada menteri susi",0,gprmswr,2023-05-22
34,34,"swiss hormone mengembalikan bentuk brast plus boolat , merapatkan misi v plus wangi sekali smilingfacewithheart - eyes smilingfacewithheart - eyes smilingfacewithheart - eyes .",positive,"swiss hormone mengembalikan bentuk brast plus boolat , merapatkan misi v plus wangi sekali smilingfacewithheart eyes smilingfacewithheart eyes smilingfacewithheart eyes .",2,ervansitanggang,2023-10-06
35,35,"resto nya bikin kangen . suasana nya enak terutama live music nya suka ramai begitu atau lagu oma oppa tempo dulu , enak banget , makanan nya juga enak-enak , harga tidak mahal , puas dan sudah ketiga kalinya ke sini",positive,"resto nya bikin kangen . suasana nya enak terutama live music nya suka ramai begitu atau lagu oma oppa tempo dulu , enak banget , makanan nya juga enakenak , harga tidak mahal , puas dan sudah ketiga kalinya ke sini",2,kominfo_tgalek,2023-12-26
36,36,sudah satu bulan ini dia magang di google indonesia .,neutral,sudah satu bulan ini dia magang di google indonesia .,0,wahsaff,2023-02-27
37,37,"makan mi di sini bikin ketagihan , mienyabeda dengan tempat makan mi yang lain . yang paling gila pedes nya , tidak berani pakai sambal lagi tidak kuat pedas .",positive,"makan mi di sini bikin ketagihan , mienyabeda dengan tempat makan mi yang lain . yang paling gila pedes nya , tidak berani pakai sambal lagi tidak kuat pedas .",2,jpalanro,2023-02-25
38,38,"kemarin saya ke gym yang di daerah kalibata . awal nya mau work out biar bisa membakar lemak . eh di luar ekspektasi , tempat nya ternyata tidak nyaman .",negative,"kemarin saya ke gym yang di daerah kalibata . awal nya mau work out biar bisa membakar lemak . eh di luar ekspektasi , tempat nya ternyata tidak nyaman .",1,valestraaa,2023-03-15
39,39,"menu warkop , tempat gaul . paling enak ke sini pagi hari masih sepi . kalau siang - malam ramai bingitzzxz . cocok untuk anak baru besar atau remaja . buat bincang bisnis tidak cocok tetlalu ramai . kopi nya gayo arabica mantap , sayang tidak ada manual brew . semuanya pakai expresso mesin . buat kawula muda cocoklah",positive,"menu warkop , tempat gaul . paling enak ke sini pagi hari masih sepi . kalau siang malam ramai bingitzzxz . cocok untuk anak baru besar atau remaja . buat bincang bisnis tidak cocok tetlalu ramai . kopi nya gayo arabica mantap , sayang tidak ada manual brew . semuanya pakai expresso mesin . buat kawula muda cocoklah",2,septiandwiss,2023-01-25
40,40,"resto ini desain interior nya cukup menawan . penataan nya cukup serasi . layanan nya cukup baik dan cepat saji . tersedia berbagai menu seperti ayam goreng , bubur ayam , cheeseburger , egg burger , fish fillet burger dan sebagai nya . ayam goreng rasanya gurih , renyah dan nikmat . bubur ayam nya terasa sangat nikmat . cheeseburger sangat terasa rasa keju nya . rata-rata masakan nya nikmat .",positive,"resto ini desain interior nya cukup menawan . penataan nya cukup serasi . layanan nya cukup baik dan cepat saji . tersedia berbagai menu seperti ayam goreng , bubur ayam , cheeseburger , egg burger , fish fillet burger dan sebagai nya . ayam goreng rasanya gurih , renyah dan nikmat . bubur ayam nya terasa sangat nikmat . cheeseburger sangat terasa rasa keju nya . ratarata masakan nya nikmat .",2,thmelind,2023-05-04
41,41,"menu bubur untuk sarapan pagi favorit semua orang . porsi cukup , tidak terlalu besar , tidak terlalu sedikit . bubur ayam lokal yang cukup untuk mengganjal perut di pagi hari .",positive,"menu bubur untuk sarapan pagi favorit semua orang . porsi cukup , tidak terlalu besar , tidak terlalu sedikit . bubur ayam lokal yang cukup untuk mengganjal perut di pagi hari .",2,puji090887,2023-01-17
42,42,"makanan nya semuanya enak banget , favorit nya nachos dan salad 90 gourmet , sushi nya juga enak , suasana nya nyaman untuk berdua atau kumpul keluarga , selalu jadi pilihan kalau lagi ingin makanan jepang atau korea .",positive,"makanan nya semuanya enak banget , favorit nya nachos dan salad 90 gourmet , sushi nya juga enak , suasana nya nyaman untuk berdua atau kumpul keluarga , selalu jadi pilihan kalau lagi ingin makanan jepang atau korea .",2,himmahonline,2023-10-07
43,43,betul . cebong-cebong pada bodoh semua maka dari itu bisa kalahkan prabowo dan bisa usir itu si anjing rizieq shihab,negative,betul . cebongcebong pada bodoh semua maka dari itu bisa kalahkan prabowo dan bisa usir itu si anjing rizieq shihab,1,moon___zlight,2023-04-03
44,44,mulai bosan nih sama pekerjaan yang sekarang,negative,mulai bosan nih sama pekerjaan yang sekarang,1,mediaindonesia,2023-06-20
45,45,tidak pernah kapok dan terus berlangganan sama pengiriman jne soal nya cepat sampai nya,positive,tidak pernah kapok dan terus berlangganan sama pengiriman jne soal nya cepat sampai nya,2,bengal54969869,2023-10-27
46,46,"bagus tempat , bagus harga , bagus rasa . ditambah live musik jadi ingin bawa doi ke sini , sayang waktu itu ngumpul nya sama teman-teman kantor , semoga lain waktu bisa datang lagi ke tjendana bistro .",positive,"bagus tempat , bagus harga , bagus rasa . ditambah live musik jadi ingin bawa doi ke sini , sayang waktu itu ngumpul nya sama temanteman kantor , semoga lain waktu bisa datang lagi ke tjendana bistro .",2,dwickysiagian,2023-10-30
47,47,makanan yang terkenal di sini adalah kepiting . kami jarang makan di tempat karena terkendala parkir . kita harus parkir di seberang jalan dan jalan nya adalah jalan besar dengan kendaraan yang terus berlalu lalang . karena itu biasanya saya dan keluarga lebih senang untuk pengiriman .,positive,makanan yang terkenal di sini adalah kepiting . kami jarang makan di tempat karena terkendala parkir . kita harus parkir di seberang jalan dan jalan nya adalah jalan besar dengan kendaraan yang terus berlalu lalang . karena itu biasanya saya dan keluarga lebih senang untuk pengiriman .,2,evandiorahmat,2023-05-29
48,48,saya tidak suka ayam . saya lindas ayam itu,negative,saya tidak suka ayam . saya lindas ayam itu,1,polresdonggala,2023-11-09
49,49,sepertinya ingin sekali marah sama indosat ini .,negative,sepertinya ingin sekali marah sama indosat ini .,1,kompascom,2023-01-05
50,50,"nama nya yang membuat saya tergelitik untuk mampir dan makan , kemudian menanyakan kepada staf mereka , kenapa nama nya sapu lidi ? tidak ada yang bisa menjawab dan baru terjawab ketika pemilik nya diwawancara disebuah stasiun televisi . sapu lidi idebtik dengan rakkyat , dengan desa / kampung . tempat ini di desain cukup unik menurut saya seunik pemilik nya juga",positive,"nama nya yang membuat saya tergelitik untuk mampir dan makan , kemudian menanyakan kepada staf mereka , kenapa nama nya sapu lidi ? tidak ada yang bisa menjawab dan baru terjawab ketika pemilik nya diwawancara disebuah stasiun televisi . sapu lidi idebtik dengan rakkyat , dengan desa kampung . tempat ini di desain cukup unik menurut saya seunik pemilik nya juga",2,nadeak_richan,2023-05-09
51,51,"kecewa sama barista yang literally menambahkan additional tanpa bilang ada biaya nya . maksud gue , kalau harga akhir produk akan berubah wajar nya dikasih tahu sebelum dia input tidak sih ? apalagi sama new pelanggan",negative,"kecewa sama barista yang literally menambahkan additional tanpa bilang ada biaya nya . maksud gue , kalau harga akhir produk akan berubah wajar nya dikasih tahu sebelum dia input tidak sih ? apalagi sama new pelanggan",1,anthonraharusu4,2023-04-05
52,52,"paling enak makan di restoran nya yang berbentuk saung di samping danau kecil . tapi untuk menggunakan tempat ini perlu reservasi , dan minimal 6 orang buat dining . harga nya relatif mahal , seperti makan restoran di jakarta . kalau kamu cuma mau makan terus pulang , mendingan makan di restoran yang di sebelah atas . tapi kalau memang mau suasana yang lebih berbau tradisional , dicoba saja .",positive,"paling enak makan di restoran nya yang berbentuk saung di samping danau kecil . tapi untuk menggunakan tempat ini perlu reservasi , dan minimal 6 orang buat dining . harga nya relatif mahal , seperti makan restoran di jakarta . kalau kamu cuma mau makan terus pulang , mendingan makan di restoran yang di sebelah atas . tapi kalau memang mau suasana yang lebih berbau tradisional , dicoba saja .",2,hestimanurung,2023-04-15
53,53,menyesal x ini . kepiting tidak bersih . gurame bau tanah . mesti banyak perbaharui qualitas makanan aneh,negative,menyesal x ini . kepiting tidak bersih . gurame bau tanah . mesti banyak perbaharui qualitas makanan aneh,1,sugaall1,2023-08-31
54,54,"renyah nya ikan goreng terasa kriuk banget , pas kongkow sama teman . , habis futsal lapor cari-cari tempat makan bareng yang tidak menghabiskan kantong saku .",positive,"renyah nya ikan goreng terasa kriuk banget , pas kongkow sama teman . , habis futsal lapor caricari tempat makan bareng yang tidak menghabiskan kantong saku .",2,faisholys,2023-01-31
55,55,"lokasi nya di dekat jalan braga . gang nya cukup untuk 2 kendaraan lewat . disarankan datang selain jam makan siang , karena makan siang tim penuh dengan pengunjung dan jumlah meja tidak terlalu banyak . mereka juga punya cabang lain di pascal square . bakmi rica terkenal karena pedas nya . ada yamien manis atau yang asin . saya lebih suka dengan mi manis .",positive,"lokasi nya di dekat jalan braga . gang nya cukup untuk 2 kendaraan lewat . disarankan datang selain jam makan siang , karena makan siang tim penuh dengan pengunjung dan jumlah meja tidak terlalu banyak . mereka juga punya cabang lain di pascal square . bakmi rica terkenal karena pedas nya . ada yamien manis atau yang asin . saya lebih suka dengan mi manis .",2,kotamagetan_,2023-01-30
56,56,"emak aku kalah lagi , sumut banyak gaya",negative,"emak aku kalah lagi , sumut banyak gaya",1,ged0ng,2023-02-08
57,57,dia sangat suka memesan ojek via grabbike,positive,dia sangat suka memesan ojek via grabbike,2,cakrahmat,2023-06-16
58,58,makanan yang bervariasi dengan lokasi yang menyatu dengan alam membuat betah untuk berlama-lama di kampung daun . ditambah saung nya tersedia bantal dan guling yang membuat semakin menjadi nyaman untuk melepas penat kehidupan kota .,positive,makanan yang bervariasi dengan lokasi yang menyatu dengan alam membuat betah untuk berlamalama di kampung daun . ditambah saung nya tersedia bantal dan guling yang membuat semakin menjadi nyaman untuk melepas penat kehidupan kota .,2,estr0gen,2023-08-02
59,59,"mau makan makanan khas belanda ? datang saja ke restauran ini , sop buntut goreng nya juara ! karena ini restoran khas belanda , banyak menu-menu khas belanda tentunya . sop buntut yang memang masakan peranakan dari negeri kincir angin ini menjadi favorit di restaurant ini .",positive,"mau makan makanan khas belanda ? datang saja ke restauran ini , sop buntut goreng nya juara ! karena ini restoran khas belanda , banyak menumenu khas belanda tentunya . sop buntut yang memang masakan peranakan dari negeri kincir angin ini menjadi favorit di restaurant ini .",2,hk_jorrs,2023-06-10
60,60,anggota fpi bekasi jadi tersangka persekusi dan pengrusakan,neutral,anggota fpi bekasi jadi tersangka persekusi dan pengrusakan,0,kotamagetan_,2023-07-31
61,61,"kecewa banget , kenapa net direkam tidak bisa dapat firstwkan di musim show . ada bener nya juga apa yang diomongin sama knetz kalau net itu tidak sesukses sunbae nya . tolong czennies kita harus lebih kerja keras lagi . gue tidak sanggup melihat net di katakan knets grup gagal nya dengan .",negative,"kecewa banget , kenapa net direkam tidak bisa dapat firstwkan di musim show . ada bener nya juga apa yang diomongin sama knetz kalau net itu tidak sesukses sunbae nya . tolong czennies kita harus lebih kerja keras lagi . gue tidak sanggup melihat net di katakan knets grup gagal nya dengan .",1,kotamagetan_,2023-12-15
62,62,cape banget kemarin kena macet malang - say dari yang jatah nya 2 jam perjalanan jadi 5 jam,negative,cape banget kemarin kena macet malang say dari yang jatah nya 2 jam perjalanan jadi 5 jam,1,fais18425226,2023-03-08
63,63,"penandatanganan perjanjian kredit ini dilakukan antara pt . kai dan sindikasi perbankan yang terdiri atas bank bni , bank bri , pt . smi , bank bca , bank cimb niaga , bank mandiri , bank mega , mufg , keb hana bank , bank dki , shinhan bank , bank sumut .",neutral,"penandatanganan perjanjian kredit ini dilakukan antara pt . kai dan sindikasi perbankan yang terdiri atas bank bni , bank bri , pt . smi , bank bca , bank cimb niaga , bank mandiri , bank mega , mufg , keb hana bank , bank dki , shinhan bank , bank sumut .",0,nizarfah,2023-09-16
64,64,fpi lagi kerja karena ketua nya perlu makan dan ongkos menginap ngekost di arab . lumayanlan bikin provikasi setiap hari dimedia memang pesanan nya begitu dari burung galak dan sapi dan aki-aki naif,negative,fpi lagi kerja karena ketua nya perlu makan dan ongkos menginap ngekost di arab . lumayanlan bikin provikasi setiap hari dimedia memang pesanan nya begitu dari burung galak dan sapi dan akiaki naif,1,agil_pramana,2023-09-19
65,65,"rasa daging rica yang mantap pedas nya yang membut mi ini semakin enak . pelayanan nya cepat . tapi tempat nya kecil . jadi siap-siap saja mengganti jika sedang jam makan siang . jus nya enak , pangsit goreng nya standar . sejak tahun 1998 saya sudah makan di sini . memang ada penurunan rasa pada mi nya . tapi secara keseluruhan , tempat ini tetap menjadi kunjungan wajib jika berlibur ke bandung .",positive,"rasa daging rica yang mantap pedas nya yang membut mi ini semakin enak . pelayanan nya cepat . tapi tempat nya kecil . jadi siapsiap saja mengganti jika sedang jam makan siang . jus nya enak , pangsit goreng nya standar . sejak tahun 1998 saya sudah makan di sini . memang ada penurunan rasa pada mi nya . tapi secara keseluruhan , tempat ini tetap menjadi kunjungan wajib jika berlibur ke bandung .",2,hanafiaryanbly,2023-03-24
66,66,tempat yang asik buat santai sama keluarga . kadang enak juga buat pertemuan di sini . pelayanan nya cukup gesit . masakan nya enak . parkir nya juga ada valet nya lho . bikin betah deh melihat kolam ikan koi - nya,positive,tempat yang asik buat santai sama keluarga . kadang enak juga buat pertemuan di sini . pelayanan nya cukup gesit . masakan nya enak . parkir nya juga ada valet nya lho . bikin betah deh melihat kolam ikan koi nya,2,tukangtelkom,2023-12-24
